,fileslug,id,sf_abstract,tags,title,link
772,S12-413_novel-epid-dosimetry-method-and,63202,Stanford researchers have developed a novel method and system of electronic portal imaging device (EPID) for radiation dosimetric measurement and quality assurance (QA) in radiation ...,Dosimetry; Radiation therapy; Linear particle accelerator; Vesicular monoamine transporter; Monte Carlo method; ,Novel EPID dosimetry method and system for radiation therapy,['http://appft1.uspto.gov/netacgi/nph-Parser?Sect1=PTO1&Sect2=HITOFF&d=PG01&p=1&u=/netahtml/PTO/srchnum.html&r=1&f=G&l=50&s1=20150343241.PGNR.&OS=DN/20150343241&RS=DN/201503432']
773,S12-409_station-parameter-optimized,63201,"Stanford researchers have discovered a novel scheme of treatment planning and delivery of radiation therapy, termed station parameter optimized radiation therapy, or SPORT.  It achieves ...",Radiation therapy; Modulation; Linear particle accelerator; Compressed sensing; ,Station parameter optimized radiation therapy (SPORT): a novel scheme for treatment planning and delivery in radiation therapy,['http://www.ncbi.nlm.nih.gov/pubmed/236352']
774,S12-397_planar-single-walled-carbon,63200,"Stanford researchers have patented a planar, single-walled carbon nanotube (SWNT) photodetector that maintains high carrier mobility, unlike conventional carbon nanotube network approaches.  Device sensitivity is ...",Carbon nanotube; Photodetector; Charge carrier; Doping (semiconductor); Infrared; Photodiode; Heterojunction; Semiconductor; Silicon; Nitride; Self-assembled monolayer; Electrode; Quantum dot; Dye; Inorganic compound; Fullerene; Fullerene chemistry; Solar cell; Motion detector; Night vision device; Remote sensing; CMOS; ,"Planar, Single-walled Carbon Nanotube Photodetector",['http://dx.doi.org/10.1002/adma.2014045']
775,S12-386_blood-test-to-determine-patient,63198,Stanford researchers have developed a test that measures transitional B cells in peripheral blood for use in determining patient responsiveness to Multiple Sclerosis (MS) treatments. ...,Multiple sclerosis; Immunotherapy; Interferon; Prognosis; Biomarker; Magnetic resonance imaging; ,Blood test to determine patient responsiveness to MS therapeutics,"['http://dx.doi.org/10.4049/jimmunol.14020', 'http://appft.uspto.gov/netacgi/nph-Parser?Sect1=PTO1&Sect2=HITOFF&d=PG01&p=1&u=%2Fnetahtml%2FPTO%2Fsrchnum.html&r=1&f=G&l=50&s1=%2220160054320%22.PGNR.&OS=DN/20160054320&RS=DN/201600543']"
776,S12-383_epilog,63196,"Today, many obstacles exist in traditional mechanisms for content licensing, commonly resulting in under-utilization of content or copyright piracy. Epilog is the rule engine that ...",Business rules engine; ,Epilog,[]
777,S12-374_power-electronics-system-that,63195,Stanford researchers have developed an efficient and low-cost device which increases the energy harvest of a system by recovering these losses through module-level maximum power ...,Power electronics; Solar panel; Maximum power point tracking; Algorithm; ,Power electronics system that harvests excess power from unbalanced photovoltaic modules to boost overall efficiency,[]
778,S12-369_method-of-organic-semiconductor,63194,"Although organic thin film transistors (OTFTs) made from organic semiconductors are valued for their transparency, flexibility and low cost attributes, their sluggish response time due ...",Thin-film transistor; Organic field-effect transistor; Organic semiconductor; Charge carrier; Organic electronics; Crystal structure; Atomic orbital; Solar cell; Thin film; Radio frequency; Naphthalene; ,Method of Organic Semiconductor Thin Film,"['http://www.nature.com/nature/journal/v480/n7378/full/nature10683.ht', 'http://onlinelibrary.wiley.com/doi/10.1002/adfm.201101606/abstra']"
779,S12-362_reagents-for-epigenetic-research,63193,"Researchers in Dr. Or Gozani’s laboratory have produced lysine methyltransferases, histone octomers, purified nucleosomes, and antibodies for use in chromatin and epigenetic research.  Epigenetics involves ...",Epigenetics; Lysine; Histone; Nucleosome; Antibody; Chromatin; Genome; Gene; Western blot; HeLa; Glutathione S-transferase; ,Reagents for Epigenetic Research,[]
780,S12-347_a-new-type-of-coupled-guided-wave,63189,An optical device includes at least one optical waveguide including a plurality of elongate portions. Light propagates sequentially and generally along the elongate portions. At ...,Slow light; Waveguide (optics); ,A new type of coupled guided-wave spiral-shaped interferometer for slow light and sensing applications,[]
781,S12-346_stable-cycling-of-lithium-sulfide,63188,"Rechargeable lithium sulfur batteries have attracted great interest in recent years because of their high theoretical specific energy, which is several times that of current ...",Lithium sulfide; Cathode; Lithium-ion battery; Anode; Polysulfide; Functional group; Polyvinylpyrrolidone; Ampere-hour; Ab initio; Polyvinylidene fluoride; Optical microscope; Digital camera; Electrode; N-Vinylpyrrolidone; Capacitance; Nanofiber; ,Stable cycling of lithium sulfide cathodes through strong affinity with multifunctional binders,['http://www.stanford.edu/group/cui_group/papers/ChemSci_2013.p']
782,S12-345_therapeutics-for-the-treatment-of,63187,Researchers in Dr. Bingwei Lu’s lab have identified genes that could serve as therapeutic targets for the treatment of Parkinson’s disease (PD).  PD is a ...,Gene; Neurodegeneration; Movement disorder; Mutation; Tremor; Hypokinesia; Mitochondrial disease; PINK1; Mitochondrion; ,Therapeutics for the Treatment of Parkinson's Disease,"['http://www.plosgenetics.org/article/info%3Adoi%2F10.1371%2Fjournal.pgen.10025', 'http://dx.doi.org/10.1016/j.devcel.2016.03.0']"
783,S12-334_mouse-strain-c57bl-6j-tg,63185,"Hemizygous mice are viable  and fertile with no anatomic abnormalities.  Transgene expression is observed in aorta, heart, and brain.  Transgenicdimethylarginine dimethylaminohydrolase (DDAH) activity is reflected ...",Zygosity; Aorta; Asymmetric dimethylarginine; Nitric oxide synthase; Cardiac muscle; Heart rate; Hypertension; Hyperlipidemia; Hypercholesterolemia; Diabetes mellitus; Stroke; Pre-eclampsia; Pathophysiology; Cardiovascular disease; ,Mouse Strain C57BL/6J-Tg,[]
784,S12-318_photo-emitter-x-ray-source-array,63184,Stanford researchers have developed a method that can enable new X-ray imaging modalities by creating an X-ray source that can be patterned. This new source ...,X-ray tube; Nondestructive testing; X-ray spectroscopy; Beam steering; Metrology; Interferometry; ,Photo Emitter X-Ray Source Array,['http://spie.org/newsroom/6495-novel-3d-x-ray-differential-phase-contrast-imaging-syst']
785,S12-313_two-dimensional-magnetic-trap,63182,"Researchers at Stanford have invented a platform to manipulate droplets in a synchronized manner. Magnetic fields combined with patterned soft magnet arrays on a substrate, ...",Magnetic trap (atoms); Boolean algebra; Ferrofluid; Microfluidics; Self-assembly; Micrometre; Electrophoresis; Dielectrophoresis; Metronome; Holography; Rational number; Energy landscape; ,Two dimensional magnetic trap arrays for droplet control,"['https://www.nature.com/articles/nphys33', 'https://journals.aps.org/pre/abstract/10.1103/PhysRevE.96.0331']"
786,S12-312_biological-cell-nanocavity-probes,63181,Stanford researchers have discovered an optical tool consisting of a semiconductor photonic crystal cavity affixed to the tip of an optical fiber. The photonic crystal ...,Photonic crystal; Optical fiber; Petri dish; Micrometre; Tungsten; Biomarker; Protein; DNA; RNA; Biomolecule; Laser diode; ,Biological cell nanocavity probes,"['http://pubs.acs.org/doi/abs/10.1021/nl30460', 'http://news.stanford.edu/news/2013/february/light-emitting-bioprobe-021913.ht']"
787,S12-308_microbial-batteries-produce-energy,63180,"An interdisciplinary team of Stanford engineers have developed a low-cost, patented, in situ method to efficiently produce electricity from organic matter such as wastewater. This ...",Organic matter; Wastewater; Anode; Microorganism; Oxygen; Diffusion; Regenerative brake; Bioreactor; Methane; Hydrocarbon; Electrical load; Prussian blue; Electrode; Microbial fuel cell; Biomass; Landfill; Dead zone (ecology); Energy; Carbon dioxide; Cathode; ,Microbial Batteries Produce Energy from Wastewater and Other Organic Matter,"['http://dx.doi.org/10.1039/C4EE0326', 'http://dx.doi.org/10.1073/pnas.13073271', 'http://news.stanford.edu/news/2013/september/wired-microbes-electricity-091613.ht']"
788,S12-307_stanford-corenlp,63179,FOR ALL LICENSING INQUIRIES PLEASE EMAIL  NLP Licensing .  Stanford CoreNLP provides a set of natural language analysis tools which take raw English language text ...,Noun phrase; Part of speech; Language technology; Natural language processing; Text mining; Business intelligence; Sentiment analysis; ,Stanford CoreNLP,[]
789,S12-300_remote-sensing-imaging-or-screening,63178,Stanford researchers have developed a new system that can detect substances such as chemicals and explosives embedded in a human host. It can also potentially ...,Remote sensing; Non-ionizing radiation; Tricorder; Electromagnetic radiation; Iterative reconstruction; Scattering; ,"Remote sensing, imaging, or screening of embedded or concealed objects","['http://appft.uspto.gov/netacgi/nph-Parser?Sect1=PTO1&Sect2=HITOFF&d=PG01&p=1&u=%2Fnetahtml%2FPTO%2Fsrchnum.html&r=1&f=G&l=50&s1=%2220150250388%22.PGNR.&OS=DN/20150250388&RS=DN/201502503', 'https://aip.scitation.org/doi/pdf/10.1063/1.49095', 'http://ieeexplore.ieee.org/xpl/login.jsp?tp=&arnumber=7329518&url=http%3A%2F%2Fieeexplore.ieee.org%2Fxpls%2Fabs_all.jsp%3Farnumber%3D73295']"
790,S12-299_high-efficiency-thermal-radiation,63177,Researchers in Prof. Shanhui Fan’s laboratory have invented a thermal extraction device that is designed to enhance power emission from thermal radiators up to 10x ...,Thermophotovoltaic; Black body; Emissivity; Solar energy; Solar cell; Operating temperature; ,"High efficiency thermal radiation extraction for thermophotovoltaic cells, efficient heating and other applications",['http://www.stanford.edu/group/fan/publication/Yu_NatureCommunications_4_1730_2013.p']
791,S12-295_a-depletion-mode-mosfet-based,63176,"Stanford researchers have developed a depletion-mode MOSFET-based phototransistor with sub-wavelength dimensions, extremely high responsivity and a low dark current. The device is highly scalable and ...",Depletion-load NMOS logic; Photodiode; Responsivity; CMOS; Electrode; MOSFET; Depletion region; Optical interconnect; Optical communication; Optical power; ,A depletion-mode MOSFET-based phototransistor,['http://appft.uspto.gov/netacgi/nph-Parser?Sect1=PTO1&Sect2=HITOFF&d=PG01&p=1&u=/netahtml/PTO/srchnum.html&r=1&f=G&l=50&s1=20140363917.PGNR.&OS=DN/20140363917&RS=DN/201403639']
792,S12-293_compartmentalized-integrated,63175,"Sensor arrays for molecular detection are often desired to contain large numbers of individual sensors. In principle, every sensor can be used to detect a ...",Analyte; Marginal utility; Microfluidics; Surface modification; Biosensor; Biochemistry; Immunoassay; Lab-on-a-chip; Chemical species; Dynamic range; Biochip; ,Compartmentalized integrated biochips,"['http://bioee.ucsd.edu/papers/Microfluidic%20multiplexed%20partitioning%20enables%20flexible%20and%20effective%20utilization%20of%20magnetic%20sensor%20arrays%20-%20Wang%20(LOC,%202015).p', 'https://patents.google.com/patent/US20140100141A']"
793,S12-289_uncovering-practice-based-evidence,63174,"Stanford researchers have developed technology that extracts relevant descriptive features from electronic medical records (EMR) using existing drug, disease and anatomy ontologies and their meta-data ...",Electronic health record; Case-control study; Adverse effect; Feature selection; Propensity score matching; Cilostazol; ,Uncovering practice based evidence for clinical risk profiling,['http://www.plosone.org/article/info:doi/10.1371/journal.pone.00634']
794,S12-284_a-brain-machine-interface-utilizing,63173,"Stanford researchers improve brain machine interfaces versatility, speed, and accuracy to previously unreported levels. The novel algorithm uses a continuous decoder and a discrete ...",Algorithm; Hidden Markov model; Neuroprosthetics; Biomedical engineering; Brain–computer interface; ,A brain machine Interface utilizing an HMM state detector,['https://doi.org/10.1109/TBME.2016.25826']
795,S12-276_method-of-rna-sample-preparation,63172,Researchers in Dr. Juan Santiago’s lab have developed a quick simple method of RNA extraction that can be used with ribonuclease (RNase)-rich samples.  RNA manipulations ...,RNA; RNA extraction; Ribonuclease; Hydrolysis; 16S ribosomal RNA; Bacteria; Polymerase chain reaction; Litre; Cerebrospinal fluid; Lysis; Protein; Nucleic acid; Precipitation (chemistry); Enzyme; Microarray; Nucleic acid thermodynamics; Electric field; Isotachophoresis; ,Method of RNA sample preparation from Ribonuclease-rich matrices,"['http://appft.uspto.gov/netacgi/nph-Parser?Sect1=PTO1&Sect2=HITOFF&d=PG01&p=1&u=%2Fnetahtml%2FPTO%2Fsrchnum.html&r=1&f=G&l=50&s1=%2220140057247%22.PGNR.&OS=DN/20140057247&RS=DN/201400572', 'http://microfluidics.stanford.edu/Publications/ITP/Rogacs_2012_Bacterial_RNA_Extraction_from_Human_Blood_using_ITP.p', 'http://cen.acs.org/articles/90/web/2012/07/RNA-Special-Treatment-Remove-Blood.ht']"
796,S12-270_nanophotonic-light-field-sensor,63171,"The Nanophotonic Light-Field (NLF) sensor enables a new generation of light field cameras capable of high sensitivity, high pixel density and faster shutter speeds. No ...",Light field; Pixel density; Charge-coupled device; F-number; Microlens; Acceptance angle (solar concentrator); Eye; Pixel; Solar cell; Crosstalk (electronics); ,Nanophotonic light-field sensor,['http://proceedings.spiedigitallibrary.org/proceeding.aspx?articleid=13821']
797,S12-267_punchcard-programmable,63170,"This light-weight, hand-held, mechanical microfluidic device is designed to perform complex protocols in low resource settings without a power source or external control element. Developed ...",Microfluidics; Biological engineering; Point of care; Drug delivery; Portable water purification; Music box; ,Punchcard Programmable Microfluidics,"['https://doi.org/10.1371/journal.pone.01159', 'https://news.stanford.edu/pr/2014/pr-chemistry-award-prakash-040814.ht']"
798,S12-266_prolonged-transgene-expression-with,63169,A team of Stanford researchers have identified DNA sequences that can increase the longevity of transgene expression from plasmids or other episomal vectors in mammals ...,Transgene; DNA; Plasmid; Small hairpin RNA; Gene therapy; Gene knockdown; DNA vaccination; ,Prolonged transgene expression with DNA spacer in plasmids or minicircles,[]
799,S12-250_cells-and-factors-for-generating,63168,"A team of Stanford researchers have identified a skeletal stem cell (SSC) along with the protein factors needed to direct differentiation toward bone, cartilage or ...",Bone; Cartilage; Bone marrow; Stromal cell; Ossification; Cell therapy; Osteosarcoma; Chondrogenesis; Osteoarthritis; Osteophyte; Protein; ,"Cells and Factors for Generating Cartilage, Bone and Bone Marrow","['http://dx.doi.org/doi:10.1016/j.cell.2014.12.0', 'http://med.stanford.edu/ism/email/pdf/2015-01-26.p']"
800,S12-243_ultra-thin-film-nanostructured,63167,"These light trapping solar cell structures increase optical absorption and carrier collection, improving efficiency by 24%, while significantly reducing the solar cell active layer thickness ...",Solar cell; Light trapping; Absorption (electromagnetic radiation); Charge carrier; Gallium arsenide; Polydimethylsiloxane; Semiconductor; ,Ultra thin film nanostructured solar cell,[]
801,S12-225_reversal-of-phic31-integrase,63166,A series of plasmids are described that either encode the RDF for expression in mammalian cells or encode the recombination sites that are substrates for ...,Integrase; Plasmid; Eukaryote; Genetic engineering; DNA; Genome; Cre recombinase; ,Reversal of phiC31 integrase recombination in mammalian cells,[]
802,S12-217_mems-based-thermionic-energy,63165,Engineers in Prof. Roger Howe’s laboratory have designed a thermionic microelectromechanical systems (MEMS) energy converter that can be used to generate AC electric power directly ...,Alternating current; Thermionic emission; Microelectromechanical systems; Anode; Power inverter; Direct current; Thermionic converter; Concentrated solar power; Actuator; Solar thermal energy; Water heating; Capacitor; ,MEMS-Based Thermionic Energy Converter for AC Power Output,[]
803,S12-205_dielectric-laser-electron,63164,"Stanford researchers have designed and simulated high-performance, compact and inexpensive integrated accelerator structures for tunable electron beam based light sources.  This accelerator can be fabricated ...",Particle accelerator; CMOS; Microelectromechanical systems; Waveguide (optics); Laser; Silicon carbide; ,Dielectric laser electron accelerators,['http://ieeexplore.ieee.org/xpl/login.jsp?tp=&arnumber=6374191&url=http%3A%2F%2Fieeexplore.ieee.org%2Fxpls%2Fabs_all.jsp%3Farnumber%3D63741']
804,S12-199_high-accuracy-object-recognition-in,63163,"Optimizing trade-offs in large-scale category, visual recognition by semantic hierarchy is a necessary problem to approach for the market of web-based advertising.  Stanford researchers have ...",Algorithm; Digital library; Outline of object recognition; ,High Accuracy Object Recognition in Still Images,[]
805,S12-196_inhibition-of-e-coli-bacterial,63162,"Urinary tract infections (UTIs) are the second most common type of infection in the body, with women having a lifetime risk of over 50 percent. ...",Escherichia coli; Biofilm; Curcumin; Urinary tract infection; Pathogenic Escherichia coli; Catheter; ,Inhibition of E. coli bacterial biofilm formation by curcumin and dimethoxycurcumin,[]
806,S12-195_multi-functional-in-vivo,63161,"Stanford researchers have proposed a novel, in vivo, real-time epifluorescence imaging method in the second near-infrared region using single-walled carbon nanotubes (SWNTs). This method provides ...",Fluorescence microscope; Infrared; Carbon nanotube; Hemodynamics; Quantification; Ischemia; Fluorophore; Optical window; Cardiovascular disease; Retina; X-ray computed tomography; Vein; Sentinel lymph node; Polymer; ,Multi-Functional In Vivo Cardiovascular Imaging Using Near-Infrared II Fluorescence,"['https://patents.google.com/patent/US20150297086A1/en?oq=14%2f443%2c8', 'http://www.nature.com/nphoton/journal/vaop/ncurrent/full/nphoton.2014.166.ht', 'http://www.nature.com/ncomms/2014/140620/ncomms5206/abs/ncomms5206.ht', 'http://www.ncbi.nlm.nih.gov/pubmed/231602']"
807,S12-191_efficient-low-threshold-germanium,63160,"Researchers at Stanford have developed a structure for a Low-Threshold Germanium laser that is easily integrable into electronic and photonic circuits, and competitive with current ...",Germanium; Laser; Optical interconnect; Gallium arsenide; CMOS; Direct and indirect band gaps; Semiconductor; Electroluminescence; ,"Efficient, Low-Threshold Germanium Laser for Easy Integration of Optical Interconnects","['http://ecst.ecsdl.org/content/64/6/371.sho', 'http://cis.stanford.edu/~saraswat/Thesis/Donguk%20Nam%20Thesis.p', 'http://scitation.aip.org/content/aip/journal/apl/100/13/10.1063/1.36992']"
808,S12-188_light-regulated-protein-stability,63159,"This light-activated system for targeted, rapid, reversible degradation of proteins of interest enables unprecedented control for direct studies of protein function. This technology is part ...",Cell culture; DNA; Drug discovery; ,Light-Regulated Protein Stability System,['http://pubs.acs.org/doi/abs/10.1021/cb40075']
809,S12-182_tumor-growth-inhibition-by-iron,63158,"Stanford researchers have developed a novel therapeutic strategy of using iron oxide nanoparticles to inhibit cancer tumor growth, spread or recurrence.  These nanoparticles prompt tumor ...",Nanoparticle; Tumor; Macrophage; Magnetic resonance imaging; Metastasis; Bioluminescence; Iron oxide; ,Tumor Growth Inhibition by Iron Oxide Nanoparticles,"['http://dx.doi.org/10.1038/nnano.2016.1', 'https://med.stanford.edu/news/all-news/2016/09/iron-nanoparticles-make-immune-cells-attack-cancer.ht', 'http://appft1.uspto.gov/netacgi/nph-Parser?Sect1=PTO1&Sect2=HITOFF&d=PG01&p=1&u=/netahtml/PTO/srchnum.html&r=1&f=G&l=50&s1=20130344003.PGNR.&OS=DN/20130344003&RS=DN/201303440']"
810,S12-177_shape-reagents-probes-for-in-vivo,63157,Researchers in the laboratories of Dr. Eric Kool and Dr. Howard Chang have created and characterized chemical probes that enable accurate RNA structural analysis in ...,Nucleic acid structure determination; Regulation of gene expression; HOTAIR; Metastasis; Breast cancer; ,SHAPE reagents — probes for in vivo and in vitro analysis of RNA structure,"['http://dx.doi.org/10.1038/nature142', 'http://dx.doi.org/10.1002/wrna.12', 'http://dx.doi.org/10.1038/nchembio.11']"
811,S12-174_ha-stem-trimer-domain,63156,"Researchers in Dr. James Swartz’s lab have developed a stable, trimeric form of the influenza hemagglutinin (HA) stem domain to be used as a novel ...",Antigen; Public health; Influenza vaccine; Glycoprotein; Antibody; Protein; ,HA Stem Trimer Domain,"['http://onlinelibrary.wiley.com/doi/10.1002/bit.24581/fu', 'http://www.google.com/patents/WO2013177444A2?cl=']"
812,S12-173_disulfide-linked-foldon-domains-to,63155,Researchers in Dr. James Swartzs lab have developed foldon domains that can be used to stabilize protein trimers even under stressful conditions that would ...,Trimer (chemistry); Protein; Protein structure; C-terminus; N-terminus; ,Disulfide-linked Foldon Domains To Stabilize Protein Trimers,[]
813,S12-172_flagellin-as-an-immunostimulant,63154,Researchers in Dr. James Swartz’s lab have developed a flagellin array that stimulates stronger and more rapid immune response.  Vaccines may be helpful in preventing ...,Flagellin; Vaccine; Antigen; ,Flagellin As An Immunostimulant,['https://www.google.com/patents/WO2013177440']
814,S12-159_assessing-risk-for-encephalopathy,63153,Encephalopathy or “chemobrain” can occur in cancer patients treated with 5-fluorouracil (5-FU) or its oral pro-drug capecitabine. Repeated episodes of encephalopathy may result in brain ...,Fluorouracil; Capecitabine; Prodrug; Gastrointestinal cancer; Esophagus; Pancreas; Mutation; Hyperammonemia; ,Assessing risk for encephalopathy induced by 5-fluorouracil or capecitabine,[]
815,S12-153_scalable-bio-element-analysis,63152,"Stanford researchers have developed a novel method of screening billions of biological elements (eg. antibodies, proteins, cells, viruses, phages, etc.) a single element at a ...",Antibody; Virus; Bacteriophage; Protein engineering; Yeast display; Screening (economics); ,Scalable Bio-Element Analysis,['http://www.nature.com/nchembio/journal/vaop/ncurrent/full/nchembio.1978.ht']
816,S12-148_tissue-engineering-scaffold-with,63150,"Researchers in Dr. Fan Yang’s lab have developed 3D tissue engineering scaffolds with dynamic, temporally and spatially controllable macropore formation.  Macropores within tissue engineering scaffolds ...",Tissue engineering; Diffusion; Cell growth; Extracellular matrix; Gel; Plastic surgery; Bone; Cartilage; 3D cell culture; Cell culture; Cell encapsulation; Luteinizing hormone; Lie; Porosity; ,Tissue engineering scaffold with controllable macropore-formation,"['http://www.google.com/patents/US201401618', 'http://www.ncbi.nlm.nih.gov/pubmed/237456', 'http://www.fanyanggroup.com/pdf/34%20Han%20Biomaterials%202013%20Dynamic%20Tissue%20Eng%20Scaffolds%20with%20stimuli-responsive%20macroporsity%20formation.p']"
817,S12-138_high-radix-interprocessor,63148,Stanford researchers and Cray Inc. have patented a highly efficient system and method for routing packets in a multiprocessor computer system. This high-radix communication system ...,Distributed shared memory; Power electronics; Solar panel; ,High-Radix Interprocessor Communications System and Method,[]
818,S12-136_nanoparticles-composed-of-short,63147,Dr. Lawrence Steinman and colleagues have identified a set of peptides that form nanoparticles that are effective anti-inflammatory agents that are therapeutic in several models ...,Peptide; Nanoparticle; Inflammation; Ischemia; B cell; Macrophage; Central nervous system; Drug delivery; Small molecule; Multiple sclerosis; Autoimmune disease; Reperfusion injury; ,Nanoparticles composed of short peptides whose receptors represent novel targets for stimulation of regulatory B cells,"['http://dx.doi.org/10.1073/pnas.152120611', 'http://www.jci.org/articles/view/7425', 'http://dx.doi.org/10.1007/s10875-014-0034-', 'http://dx.doi.org/10.1177/135245851348985', 'http://www.ncbi.nlm.nih.gov/pmc/articles/PMC4411183', 'http://stm.sciencemag.org/content/5/179/179ra4', 'http://www.ncbi.nlm.nih.gov/pmc/articles/PMC3476308', 'http://www.ncbi.nlm.nih.gov/pmc/articles/PMC3322989', 'http://www.ncbi.nlm.nih.gov/pmc/articles/PMC3156222', 'http://www.annalsthoracicsurgery.org/article/S0003-4975%2811%2900499-1/pd', 'http://www.ncbi.nlm.nih.gov/pmc/articles/PMC3178147', 'http://www.jimmunol.org/content/186/7/4263.lon']"
