,fileslug,id,sf_abstract,tags,title,link
446,S16-176_wolverine-a-wearable-haptic,63608,"Stanford researchers have recently debuted the “Wolverine,” a mobile, wearable haptic device designed for simulating the grasping of rigid objects in virtual reality. In contrast ...",Virtual reality; Haptic technology; Force; Kilowatt hour; Joule; 3D scanner; Bluetooth; ,Wolverine: A Wearable Haptic Interface for Grasping in Virtual Reality,[]
447,S16-173_fates-compact-sensitive-x-ray,63607,"Researchers in Prof. Lambertus Hesselink’s laboratory have developed a compact, sensitive X-ray differential phase contrast (DPC) imaging system that improves field of view, increases fringe ...",Microscopy; X-ray tube; X-ray detector; Medical imaging; Nondestructive testing; Refractive index; Data acquisition; ,"Fates - Compact, Sensitive X-ray Differential Phase Contrast Imaging System",[]
448,S16-157_cart-a-transfection-delivery-system,63604,Stanford researchers have developed a new class of materials that enable new strategies for the efficient delivery of messenger RNA (mRNA) into cells and animals. ...,Transfection; Messenger RNA; Nuclease; Biodegradation; Intramolecular reaction; Protein; Plasmid; Bioluminescence; Luciferase; Mouse; Immunotherapy; Gene therapy; Cellular differentiation; Lipid; PH; ,CART- a transfection delivery system for efficient intracellular mRNA delivery,"['http://www.pnas.org/content/115/39/E91', 'http://www.pnas.org/content/114/4/E4', 'http://www.pnas.org/content/115/26/E58', 'https://pubs.acs.org/doi/10.1021/acs.biomac.8b004']"
449,S16-145_apparatus-for-mm-wave-radiation,63602,"Stanford researchers have developed a vacuum tube technology, where the device size is inherently larger than the operating wavelength.  It can generate high power mm-wave ...",Electromagnetic radiation; whispering-gallery wave; Resonator; Vacuum tube; Voltage; Electromagnetic spectrum; Dust storm; Frequency; Frequency multiplier; Space charge; Microwave; ,Apparatus for mm-wave radiation generation utilizing whispering gallery mode resonators,['http://accelconf.web.cern.ch/accelconf/ipac2016/papers/mopmy036.p']
450,S16-139_energy-storage-in-closed-loop,63598,"Stanford researchers at the Spormann Lab have developed a highly efficient, flexible, and scalable system to store electric energy in a closed loop system.  This ...",Electrode; Hydrocarbon; Oxy-fuel; Methane; System dynamics; Nuclear power; ,Energy Storage in Closed Loop Systems using Microbial Conversion,[]
451,S16-135_tuning-of-reversible-and,63597,Stanford researchers have developed a method that can tune the ratio between reversible (RE) and irreversible (IRE) electroporation through waveform adjustments.  This is accomplished by ...,Electroporation; Waveform; Gene therapy; Blood–brain barrier; Electric field; Tumor; Synthetic biology; Transfection; Drug delivery; ,Tuning of reversible and irreversible electroporation lesions by manipulating pulse waveforms,['http://www.nature.com/articles/srep407']
452,S16-131_electrodes-and-separator-for,63596,"A team of engineers has developed high-performance, stretchable components for lithium-ion batteries using an easy, low-cost, scalable synthesis. These electrodes and separators could replace rigid ...",Lithium-ion battery; Electrode; Wearable computer; Polydimethylsiloxane; Anode; Lithium iron phosphate; Cathode; ,Electrodes and Separator for Stretchable Lithium-Ion Batteries,['http://dx.doi.org/10.1002/adma.2015052']
453,S16-125_activity-dependent-expression,63595,"Researchers in Prof. Karl Deisseroth’s laboratory have engineered versatile, virus-based constructs that are driven by neuronal activity to either label or optogenetically control those active ...",Gene expression; Biological neural network; Neuron; Complex cell; Prefrontal cortex; Optogenetics; Opsin; Cre recombinase; Microinjection; Axon; Knowledge representation and reasoning; ,Activity-dependent expression system for labeling and optogenetic control of neuronal circuits,"['http://web.stanford.edu/group/dlab/media/papers/yeCell2016.p', 'http://news.stanford.edu/2016/05/26/stanford-research-shows-different-brain-cells-process-positive-negative-experience']"
454,S16-124_circular-rna-and-immune-stimulation,63594,Researchers in Prof. Howard Chang’s lab at Stanford along with researchers at Emory University have developed a method of using circular RNA (circRNA) to activate ...,Circular RNA; Non-coding RNA; Eukaryote; Exonuclease; Antibody; ,Circular RNA and immune stimulation,"['http://www.cell.com/molecular-cell/fulltext/S1097-2765(17)30362', 'http://dx.doi.org/10.1016/j.molcel.2017.05.022']"
455,S16-115A_handheld-raman-device-to-guide,63591,"In order to help guide surgeons during resection surgery, Stanford researchers have designed and optimized a novel strategy to identify tumor margins in real time. ...",Tumor; Nanoparticle; In vivo; Histopathology; Scanning probe microscopy; Esophagus; Molecular imaging; Fluorescence; Raman spectroscopy; Proximity sensor; Stainless steel; Optimal design; Surface enhanced Raman spectroscopy; Pathology; Lumpectomy; Cauterization; Melanoma; Pancreatic cancer; Endoscopy; ,Handheld Raman device to guide tumor resection in real time,"['https://patents.google.com/patent/US20180164218A1/en?oq=15%2f835%2c6', 'http://dx.doi.org/10.1073/pnas.12113091']"
456,S16-115_a-new-optical-topography-imaging,63590,"Addressing the need for real time diagnostics to determine if entire tumors has been resected during debulking surgery, Stanford researchers have developed a revolutionary new ...",Debulking; Tumor; Molecular imaging; Proximity sensor; Histopathology; Biopsy; Haptic technology; Intravenous therapy; Acoustics; ,A New Optical Topography Imaging Device to Detect Disease in Excised Tissue,['https://patents.google.com/patent/US20180164217A1/en?oq=15%2f835%2c5']
457,S16-105_phosphorylation-specific-anti,63589,Researchers in Prof. Anne Brunet’s laboratory have developed a rabbit polyclonal antibody to the C-terminal region of pFoxO3(S-588) that can be used study cellular homeostasis. ...,Polyclonal antibodies; C-terminus; Homeostasis; Transcription factor; Apoptosis; Phosphorylation; AMP-activated protein kinase; Adenosine monophosphate; Protein kinase; Antibody; Fusion protein; Glutathione S-transferase; ,Phosphorylation-specific anti pFoxO3 (S-588) Antibody,['http://dx.doi.org/10.1074/jbc.M7053252']
458,S16-098_monoclonal-antibody-to-cd6-clone-34,63588,Researchers at Stanford have created a monoclonal antibody to CD6.  CD6 is a surface molecule expressed on T cells and some B cells.  It may ...,Antibody; CD6; Monoclonal antibodies; T cell; B cell; Multiple sclerosis; Rheumatoid arthritis; Pathogenesis; Regulatory T cell; CD5 (protein); Haematopoiesis; ,"Monoclonal antibody to CD6, Clone 34-3",['http://dx.doi.org/10.1073/pnas.16152531']
459,S16-097_dmn-tre-a-probe-for-the-rapid,63587,"TB is the leading cause of death from infectious disease worldwide. Current gold standards for identifying  Mycobacterium tuberculosis  (Mtb), the causative agent of tuberculosis (TB), ...",Mycobacterium; Mycobacterium tuberculosis; Sputum; Infection; Solvatochromism; Trehalose; Cell wall; Gram-positive bacteria; Microbiology; Mycobacterium smegmatis; Corynebacterium; Reagent; Clinical trial; Glycolipid; Viability assay; LYN; ,"DMN-Tre: A probe for the rapid, simple, and specific detection of mycobacteria with applications for the rapid diagnosis of <i>M. tuberculosis</i> in sputum from TB patients.",['http://stm.sciencemag.org/content/10/430/eaam63']
460,S16-094_screening-tool-to-detect-myc-driven,63585,Researchers at Stanford have developed screening tools to detect MYC-driven cancers and identify when an immune-based therapy will be beneficial for a patient.  Immune-based therapies ...,Immune system; Myc; Transcription factor; Tumor; Carcinogenesis; CD47; PD-L1; ,Screening tool to detect MYC-driven cancers and stratify patients for immune-based therapies,"['http://dx.doi.org/10.1126/science.aac99', 'https://med.stanford.edu/news/all-news/2016/03/protein-increases-signals-that-protect-cancer-cells.ht']"
461,S16-093_low-cost-high-throughput-clarity,63584,"Researchers in Prof. Karl Deisseroth’s laboratory have developed a low-cost, high-throughput system for high resolution light-sheet imaging to visualize individual cells throughout a volume of ...",Axon; Biological neural network; Projection mapping; Scale analysis (mathematics); Prefrontal cortex; Neuron; Perfusion; ,"Low Cost, High-Throughput CLARITY Imaging with Single-Cell Resolution and Axon Visualization","['http://web.stanford.edu/~wallen/papers/deisseroth_trap16.p', 'http://news.stanford.edu/2016/05/26/stanford-research-shows-different-brain-cells-process-positive-negative-experience', 'https://patents.google.com/patent/WO2017205531A1/en?oq=WO+2017%2f2055']"
462,S16-092_method-and-system-for-whole-brain,63583,"Please see the technology description for the related invention -  Low Cost, High-Throughput CLARITY Imaging with Single-Cell Resolution and Axon Visualization  (Stanford Docket S16-093).   Related ...",,Method and system for whole brain imaging and analysis,[]
463,S16-087_personalized-cancer-therapy-with,63582,Researchers in Prof. Sylvia Plevritis’ laboratory have developed an algorithm designed to optimize cancer combination therapy for individual patients by analyzing distinct single-cell responses from ...,Algorithm; RNA-Seq; Phenotype; Clinical trial; Intratumoral; Drug resistance; Gene expression; ,Personalized cancer therapy with single cell analysis of heterogeneous tumors,"['https://doi.org/10.1073/pnas.17113651', 'http://dx.doi.org/10.1073/pnas.08098221', 'http://dx.doi.org/10.1371/journal.pcbi.10036', 'http://dx.doi.org/10.1038/nprot.2016.0']"
464,S16-086_synthesis-of-uniformly-sized-water,63581,"Researchers in Prof. Roger Kornberg’s laboratory have developed a high-yield, controlled technique to synthesize water-soluble, thiolate-protected gold nanoparticles of homogeneous size without a purification step. ...",Nanoparticle; Thiol; Immunoassay; Drug delivery; Protein; DNA; Reagent; ,"Synthesis of uniformly-sized, water-soluble gold nanoparticles",['http://dx.doi.org/10.1021/acs.nanolett.6b009']
465,S16-049_coherence-based-beamforming-for,63579,Stanford researchers have produced contrast-enhanced ultrasound (CEUS) images with increased sensitivity to microbubble contrast agents. The proposed technique utilizes the coherence properties of the ultrasound ...,Beamforming; Contrast-enhanced ultrasound; Microbubbles; Johnson–Nyquist noise; Reverberation; Dynamic range; Noise floor; ,Coherence-Based Beamforming for Improved Microbubble Detection in Contrast Enhanced Ultrasound,[]
466,S16-040_fast-coherent-flow-power-doppler,63578,Stanford researchers have proposed a fast way to produce high quality ultrasound power Doppler images based on the coherence properties of ultrasound. This method produces ...,Medical ultrasonography; Doppler imaging; Johnson–Nyquist noise; Reverberation; Coherence (physics); Frame rate; Signal-to-noise ratio; Placenta; Liver; Transcranial Doppler; Beamforming; ,Fast Coherent Flow Power Doppler Imaging,['http://ieeexplore.ieee.org/xpl/login.jsp?tp=&arnumber=7119983&url=http%3A%2F%2Fieeexplore.ieee.org%2Fxpls%2Fabs_all.jsp%3Farnumber%3D71199']
467,S16-038_luminescence-assay-for-nucleotide,63577,Researchers at Stanford have developed novel specific probes and assays that enable luminescence reporting of the activation of nucleotide pool sanitation enzymes. These sanitation proteins ...,Fluorescence; Protein; Nudix family; DNA replication; Mutation; Tumor; Mouse; Assay; Adenosine triphosphate; Luciferase; Clinical trial; Molecular biology; ,Luminescence Assay for Nucleotide Pool Sanitation Enzyme Activity,['https://doi.org/10.1021/jacs.6b028']
468,S16-025_high-throughput-precision-genome,63575,Researchers at Stanford have developed a rapid and efficient method for high-throughput genome editing using CRISPR/Cas9.  The CRISPR/Cas9 system allows researchers to edit any site ...,CRISPR; ,High-throughput precision genome editing,['https://patentscope.wipo.int/search/docservicepdf_pct/id00000041596780/PAMPH/WO2018049168.pdf?psAuth=i_ltPI78oLJLoyxpDBFfB8XtimDvYTMw3ku1iKSdb']
469,S16-022_i-in-vivo-i-site-specific-protein,63573,"Researchers at Stanford and the National Institute of Standards  Technology have developed a general, high-yielding protein modification strategy that uses inexpensive commercially available reagents. ...",Protein; Sortase; Staphylococcus aureus; Peptide synthesis; Escherichia coli; Bioconjugation; Glycine; Reagent; HER2/neu; Peptide; ,<i>In vivo</i> site-specific protein tagging using engineered sortase variants,['http://pubs.acs.org/doi/ipdf/10.1021/jacs.6b038']
470,S16-019_multi-radius-endovascular-torque,63572,"Stanford researchers have developed a simple, low cost, multi-radius torque device to be used with a guide wire for any endovascular procedure. The multi-radius ability ...",Torque; Vascular surgery; ,Multi Radius Endovascular Torque Device,[]
471,S16-017_biomarker-to-enrich-for,63571,Stanford researchers have identified a biomarker on cartilage precursor cells that predicts which cells will develop into inflammation-resistant and functionally appropriate tissue for autologous transplants ...,Osteoarthritis; Biomarker; Cartilage; Precursor cell; Autotransplantation; Hyaline cartilage; Chondrocyte; CD24; Regenerative medicine; Tissue engineering; Fibrocartilage; ,Biomarker to Enrich for Inflammation-Resistant Cartilage to Treat Osteoarthritis,['https://www.ncbi.nlm.nih.gov/pubmed/279556']
472,S16-012_gecko-adhesive-for-gentle-robotic,63570,"Engineers in Prof. Mark Cutkosky’s laboratory have developed a gentle gripper device that can conform to, grasp, and lift a wide range of objects using ...",Adhesive; Force; Prosthesis; Industrial robot; ,Gecko-adhesive for gentle robotic grasping of irregular objects,[]
473,S16-005_a-method-for-faster-sensitive,63569,Stanford Prof. Juan Santiago and a team of engineers have developed a method of speeding up chemical reactions between a probe on a surface and ...,Isotachophoresis; Biomolecule; Fluorescence spectroscopy; Analyte; Bioassay; Immunoassay; Nucleic acid thermodynamics; Microfluidics; Electrolyte; Surface plasmon; DNA; RNA; ,"A Method for Faster, Sensitive Biomolecular Detection in Surface Reaction Assays",['https://patents.google.com/patent/US20160209407A1/']
474,S15-476_novel-catheter-based-imaging-probe,63566,Researchers at Stanford have developed a dual modality imaging probe to provide improved atherosclerosis detection and evaluation.   Atherosclerosis is a disease in which plaque builds ...,Atherosclerosis; Artery; Coronary artery disease; Coronary catheterization; Angiography; Nuclear medicine; X-ray computed tomography; Vulnerable plaque; Paradigm shift; Histopathology; Histology; Lipid; Fatty acid; Cholesterol; Ester; Phospholipid; Triglyceride; Calcium; Elastin; Collagen; ,Novel Catheter Based Imaging Probe for Detection of Vulnerable Plaque,[]
475,S15-472_phase-shifting-by-mechanical,63565,Stanford researchers developed a method to make large phase shifts with little or no power dissipation in integrated optics.  The approach uses a directional coupler ...,Phase (waves); Photonic integrated circuit; Power dividers and directional couplers; Microelectromechanical systems; Actuator; Photonics; Waveguide; Integrated circuit; Absorption (electromagnetic radiation); Modulation; Telecommunication; Optoelectronics; Interposer; Silicon-germanium; Optical interconnect; Photodetector; Radio frequency; Radar; ,Phase Shifting by Mechanical Movement in Integrated Photonics Circuits,[]
476,S15-467_soluble-factors-to-enhance-stem,63564,"Stanford researchers have identified soluble factors that can enhance the growth of mesenchymal stem cells (MSCs), while maintaining their phenotype and function, for use in ...",Stem cell; Cartilage; Mesenchymal stem cell; Hyaline cartilage; Tissue engineering; Chondrocyte; Collagen VI; Biologic medical product; Articular cartilage repair; Microfracture surgery; Endogeny; Cell growth; Phenotype; STEM fields; ,Soluble factors to enhance stem cell growth and function for use in cartilage regeneration,"['http://appft.uspto.gov/netacgi/nph-Parser?Sect1=PTO1&Sect2=HITOFF&d=PG01&p=1&u=%2Fnetahtml%2FPTO%2Fsrchnum.html&r=1&f=G&l=50&s1=%2220170209621%22.PGNR.&OS=DN/20170209621&RS=DN/201702096', 'http://dx.doi.org/10.1089/ten.TEA.2015.03']"
477,S15-464_novel-broad-spectrum-antiviral,63563,"Researchers in Dr. Michael Bassik’s and Dr. Chaitan Khosla’s labs have developed a new broad spectrum antiviral therapeutic that targets host cell processes, rather than ...",Antiviral drug; Virus; Pathogen; Pyrimidine; Drug resistance; Small hairpin RNA; ,Novel broad-spectrum antiviral therapeutic,['http://www.nature.com/nchembio/journal/vaop/ncurrent/full/nchembio.2050.ht']
478,S15-463_method-for-enhanced-microbial,63562,Researchers in Dr. Alfred Spormann’s lab have developed a method of using co-cultures to enhance microbial electrosynthesis to allow more efficient production of desired products ...,Microbial electrosynthesis; Biofuel; Electrosynthesis; Microorganism; Biosynthesis; Photosynthesis; ,Method for enhanced microbial electrosynthesis by using defined co-cultures,['http://appft1.uspto.gov/netacgi/nph-Parser?Sect1=PTO1&Sect2=HITOFF&d=PG01&p=1&u=/netahtml/PTO/srchnum.html&r=1&f=G&l=50&s1=20170166883.PGNR.&OS=DN/20170166883&RS=DN/201701668']
479,S15-461_a-micro-fabricated-chemical-gas,63561,Stanford researchers have designed and tested an electrochemical gas sensor which can detect volatile organic species in the gas phase and differentiate multiple species with ...,Gas detector; Reduction potential; Electrode; Reference electrode; Nafion; Polymer; ,A micro-fabricated chemical gas sensor for detection of volatile pollutants and explosives,"['http://appft.uspto.gov/netacgi/nph-Parser?Sect1=PTO1&Sect2=HITOFF&d=PG01&p=1&u=/netahtml/PTO/srchnum.html&r=1&f=G&l=50&s1=20170199147.PGNR.&OS=DN/20170199147&RS=DN/201701991', 'http://otl.stanford.edu/lagan/15461/article.p', 'http://otl.stanford.edu/lagan/15461/poster.p']"
480,S15-458_thermoresponsive-material-to,63560,"A team of Stanford engineers has developed a high-performance, ultrafast, thermoresponsive polymer that can act as a circuit breaker to prevent fires in next-generation high-energy-density ...",Polymer; Circuit breaker; Thermal runaway; Nickel; Nanoparticle; Graphene; Thin film; Polyethylene; Consumer electronics; Grid energy storage; Conductive polymer; ,Thermoresponsive Material to Prevent Battery Fire,"['http://www.nature.com/articles/nenergy201', 'http://onlinelibrary.wiley.com/doi/10.1002/aelm.201600397/abstra', 'http://news.stanford.edu/news/2016/january/safe-battery-toggle-011116.ht']"
481,S15-455_metal-halide-double-perovskites-as,63559,"The perovskite (MA)PbX 3  (MA  CH3NH3+, X  Br– or I–) has recently generated great interest as a low- cost absorber for high-efficiency solar cells. ...",Solar cell; Solubility; Optoelectronics; X-ray crystallography; Cubic crystal system; Band gap; Fluorescence; Carrier lifetime; ,Metal-halide double perovskites as solar-cell absorbers,"['http://appft.uspto.gov/netacgi/nph-Parser?Sect1=PTO1&Sect2=HITOFF&d=PG01&p=1&u=/netahtml/PTO/srchnum.html&r=1&f=G&l=50&s1=20170194101.PGNR.&OS=DN/20170194101&RS=DN/201701941', 'http://web.stanford.edu/group/karunadasalab/Images/publications/paper11.p']"
482,S15-444_paperfuge-a-low-cost-high-speed,63557,Researchers at Stanford have developed the paperfuge- an ultra-low cost (             Using paperfuge to separate plasma from whole blood       Stage of research  The inventors have ...,Global health; Centrifuge; Common Era; Oscillation; Microfluidics; Polydimethylsiloxane; Centrifugation; Hematocrit; Anemia; Point of care; Incineration; Polymer; Injection molding; Biological engineering; ,"Paperfuge: a low-cost, high-speed, human-powered centrifuge","['http://dx.doi.org/10.1101/0722', 'http://news.stanford.edu/2017/01/10/whirligig-toy-bioengineers-develop-20-cent-hand-powered-blood-centrifug']"
483,S15-443_bipolar-dc-dc-converter-for-compact,63556,Stanford researchers developed a DC-DC converter that efficiently produces high voltage bi-polar pulses with flexible profiles for electroporation and other applications.  The design harnesses energy ...,DC-to-DC converter; Voltage; Electroporation; Power inverter; Spacecraft propulsion; Plasma (physics); Electric field; Electrode; Transformer; World Rally Championship; Direct current; ,Bipolar DC-DC Converter for Compact Power Supplies,['http://ieeexplore.ieee.org/document/755675']
484,S15-439_ultra-wide-field-high-resolution,63554,Stanford Researchers have developed a microscope that can image a 2.5cm 2  at a resolution of 3microm in 1 second. The color filter is ...,Fluorophore; Operating theater; Histopathology; Cell culture; Bioluminescence; High-throughput screening; ,"Ultra-Wide Field, High-Resolution Fluorescent Microscope",['https://patentscope.wipo.int/search/docservicepdf_pct/id00000041276638/PAMPH/WO2018031881.pdf?psAuth=qvXwaQTtntqG0mjMFL2hQJn8qqtzIB29UbgF_DvWV']
485,S15-438_stretchable-semiconductor-via,63553,Stanford researchers have created a highly stretchable organic semiconductor by blending high mobility semiconducting polymers with an elastomer.  The CONPHINE (conjugated polymer/elastomer phase separation induced ...,Semiconductor; Polymer; Elastomer; Charge carrier; Biocompatibility; Prosthesis; Electron mobility; Thin-film transistor; Light-emitting diode; Semiconductor device; Thin film; Organic semiconductor; Nathan Wang; Semiconductor (artists); ,Stretchable Semiconductor via Polymer Blending,['http://science.sciencemag.org/content/355/6320/59.fu']
486,S15-437_platform-for-functional-analysis-of,63552,Researchers at Stanford have developed a microscopy and video imaging platform that integrates different analytical approaches to assay the cardiac function of cardiomyocytes (CMs) differentiated ...,Cardiac muscle; Assay; Stem cell; Cardiovascular disease; Induced pluripotent stem cell; Protein; Gel; Sarcomere; Myofibril; Micropatterning; Cardiotoxicity; Mutation; Gene expression; Myocyte; ,Platform for functional analysis of human pluripotent stem cell-derived cardiomyocytes,['https://doi.org/10.1161/CIRCRESAHA.116.3103']
487,S15-434_agents-to-induce-immunogenicity-and,63551,Researchers at Stanford have developed agents to enhance the therapeutic efficacy of a variety of anti-cancer therapeutics.  Cell loss by apoptosis occurs in normal development ...,Immunogenicity; Apoptosis; Tumor; Phosphatidylserine; Antigen; T cell; T-cell receptor; Radiation therapy; Chemotherapy; Immunotherapy; Protein; ,Agents to induce immunogenicity and improve efficacy of anti-cancer therapeutics,['https://patentscope.wipo.int/search/en/detail.jsf?docId=WO2018031419&redirectedID=tr']
488,S15-432_instrumented-mouthguard-to,63550,Stanford researchers at the Camarillo Lab have designed an instrumented mouthguard which provides accurate measurements of head motion during impacts. The accurate measurements are achieved ...,Mouthguard; ,Instrumented Mouthguard to Determine Accurate Head Motion During Impacts,['http://dx.doi.org/10.1098/rsif.2015.03']
489,S15-430_method-to-completely-characterize,63549,Stanford researcher Paul Norman has developed an integrated capture/next-gen sequencing/ bioinformatics method to completely characterize the structure and sequence of the highly polymorphic killer cell ...,Polymorphism (biology); Bioinformatics; Protein; Natural killer cell; Human leukocyte antigen; Allele; Oligonucleotide; DNA; Genotype; Hematopoietic stem cell transplantation; Immunotherapy; 1000 Genomes Project; Population genetics; Mostafa Ronaghi; Genetic code; KIR2DL4; DNA sequencing; ,Method to completely characterize the highly polymorphic KIR genomic region,"['http://www.sciencedirect.com/science/article/pii/S00029297163022', 'http://dx.doi.org/10.1002/eji.2015462', 'http://dx.doi.org/10.1111/tan.127']"
490,S15-425_method-for-chemogenetic-suppression,63548,"Researchers in Dr. Scott Delp’s lab have developed a new chemogenetic approach to manage chronic pain that is specific, reversible, long-acting, and non-addictive.  Chronic pain ...",Chronic pain; Afferent nerve fiber; Signal transduction; Mouse; Motor neuron; Neuromodulation; Bioavailability; Peripheral nervous system; ,Method for chemogenetic suppression of pain,[]
491,S15-418_localized-sustained-release,63547,"Disease indication  - Arthritis and other mast-cell mediated inflammatory diseases, such as osteoarthritis, crystal-induced arthritis, psoriatic arthritis, tenosynovitis, synovitis, allergic/non-allergic/chronic rhinitis, rhinosinusitis, conjunctivitis and ocular ...",Inflammation; Rheumatoid arthritis; Psoriatic arthritis; Tenosynovitis; Conjunctivitis; Allergic conjunctivitis; Uveitis; Nasal polyp; Asthma; Aspirin; Respiratory disease; Chronic obstructive pulmonary disease; Eosinophilic esophagitis; Time release technology; Tyrosine-kinase inhibitor; Mouse; Corticosteroid; Cartilage; Gout; Chondrocalcinosis; Tyrosine kinase; Mast cell; CD117; Pharmaceutical drug; ,"Localized, Sustained-Release Arthritis Treatment",[]
492,S15-415_novel-aav-capsids-with-enhanced,63545,Researchers in Prof. Mark Kay’s laboratory have developed novel recombinant adeno-associated viral (AAV) capsids via capsid gene shuffling that transduce human skeletal muscle (HSM) specifically ...,Capsid; Gene therapy; Skeletal striated muscle; Primate; Cell culture; Explant culture; Antibody; Muscular dystrophy; Peptide; ,Novel AAV Capsids with Enhanced Human Skeletal Muscle Tropism,[]
