,fileslug,id,sf_abstract,tags,title,link
1077,S09-004_allergy-testing-with-small-whole,62824,A team of Stanford researchers has developed a FACS-based method to quickly and safely determine allergic reactions using white blood cell analysis. This technique involves ...,Allergy test; White blood cell; Granulocyte; Basophil granulocyte; Eosinophil granulocyte; Antigen; Skin allergy test; Allergen; Omalizumab; Tree nut allergy; André Gernez; ,Allergy testing with small whole blood samples,"['http://appft1.uspto.gov/netacgi/nph-Parser?Sect1=PTO1&Sect2=HITOFF&d=PG01&p=1&u=%2Fnetahtml%2FPTO%2Fsrchnum.html&r=1&f=G&l=50&s1=%2220100209950%22.PGNR.&OS=DN/20100209950&RS=DN/201002099', 'http://content.karger.com/produktedb/produkte.asp?DOI=000321824&typ=p']"
1078,S08-441_oligocarbonate-molecular,62823,"Stanford University researchers have developed a new family of oligocarbonate molecular transporters (OMTs) that penetrate cell membranes and tissues. The invention, which includes the method ...",Cell membrane; Oligomer; Oligonucleotide; Peptide; Nucleic acid; Biologic medical product; Plasmid; Guanidine; Covalent bond; ,Oligocarbonate molecular transporters across biological barriers,['http://www.ncbi.nlm.nih.gov/pmc/articles/PMC2789006/?tool=pubm']
1079,S08-438_rapid-ips-cells-from-adult-human,62822,A team of Stanford researchers has developed a novel method for quickly and efficiently generating human induced pluripotent stem cells (hiPSCs) using human adipose stem ...,Induced pluripotent stem cell; Adipose tissue; Fibroblast; Mouse; Gene expression profiling; Cell potency; DNA; Regenerative medicine; Kidney; Adipocyte; Autotransplantation; ,Rapid iPS Cells from Adult Human Adipose Stem Cells,['http://www.pnas.org/content/106/37/15720.lo']
1080,S08-436_magnetic-separation-for-cell,62820,Engineers in Prof. Shan Wangs laboratory have developed a patented magnetic sifter device for high throughput cell sorting.  This technology employs magnetic nanobead probes ...,Flow cytometry; Proteomics; Circulating tumor cell; ,"Magnetic Separation for Cell Sorting and AnalysisRe-Marketing Materials for your review for S08-436, ""Magnetic Separation for Cell Sorting and Analysis""","['http://dx.doi.org/10.1039/C3LC5058', 'http://www.sciencedirect.com/science?_ob=ArticleURL&_udi=B6TJJ-4VNH46B-18&_user=145269&_rdoc=1&_fmt=&_orig=search&_sort=d&_docanchor=&view=c&_searchStrId=1024568492&_rerunOrigin=google&_acct=C000012078&_version=1&_urlVersion=0&_userid=145269&md5=66a3c1eb1eb23efcc017f919febaa1']"
1081,S08-431_novel-minicircle-vector-for-cardiac,62819,A team of Stanford inventors have developed a robust non-viral gene therapy technique for delivering genes to treat cardiovascular disease.  This technology relies on a ...,Gene therapy; Cardiovascular disease; Vector (molecular biology); Transfection; Gene expression; Plasmid; Immunogenicity; Reporter gene; Hypoxia (medical); Hypoxia-inducible factors; Infarction; ,Novel Minicircle Vector for Cardiac Gene Therapy,[]
1082,S08-427_ct-optimal-weights-for-measuring,62818,A method for determining a composition of an object using a spectral x-ray system is provided. X-ray photons of at least two different energies are ...,Photon; Attenuation coefficient; ,CT - Optimal weights for measuring spectral x-ray data,[]
1083,S08-424_transparent-electrodes-composed-of,62817,"Researchers in Prof. Zhenan Baos laboratory have developed a solution-based process for fabricating thin film transparent electrodes with high flexibility, high conductivity, and low ...",Electrode; Carbon nanotube; Thin film; Organic semiconductor; Thin film solar cell; Flat panel display; Indium tin oxide; ,Transparent electrodes composed of carbon nanotube bundle networks,['http://pubs.acs.org/doi/abs/10.1021/nn90024']
1084,S08-420_molecular-imaging-for,62816,"Stanford researchers have developed a molecular imaging system for the detection and monitoring of differentiated pluripotent stem cells and dedifferentiated adult stem cells.  Oct4 gene, ...",Molecular imaging; Adult stem cell; Oct-4; Transcription factor; Embryonic stem cell; Cell potency; Cellular differentiation; Gene expression; Transgene; Endogeny; Reporter gene; Cell culture; Induced pluripotent stem cell; ,Molecular imaging for differentiation of pluripotent stem cell and reprogramming of adult cell into pluripotent stem like cell,[]
1085,S08-418_multiple-myeloma-treatment-with,62815,Researchers in Prof. Albert Koong’s laboratory identified a small molecule inhibitor of Ire1 (Inositol-requiring enzyme 1) that could be used to treat multiple myeloma. Ire1 ...,Multiple myeloma; ERN1; Small molecule; Enzyme inhibitor; Protein kinase; Xenotransplantation; Cytotoxicity; ,Multiple Myeloma Treatment with IRE1 Inhibitor,['http://dx.doi.org/10.1182/blood-2010-08-3030']
1086,S08-407_cystine-knot-peptides-that-target,62814,"Stanford researchers have developed a patented technology for inhibiting thrombosis. Specifically, theyve identified small, stable peptides that bind to alpha iib beta 3, an ...",Cystine knot; Peptide; Thrombosis; Platelet; Protein; Screening (economics); Antiplatelet drug; Eptifibatide; Drug-eluting stent; Angioplasty; Thrombus; Integrin; ,Cystine-knot peptides that target αIIbβ3 integrin,['http://dx.doi.org/10.1002/jmr.10']
1087,S08-390_lymphatic-access-platform,62810,Excessive fluid accumulation in the lungs can lead to lung damage and even respiratory failure. Stanford University researchers have developed a novel method and device ...,Pulmonary edema; ,Lymphatic Access Platform,[]
1088,S08-384_octave-wide-mid-infrared-frequency,62809,Researchers in Prof. Robert Byers laboratory have developed a new fiber laser technology for generating frequency combs with broadband output (an octave or more). ...,Fiber laser; Frequency comb; Bandwidth (signal processing); Octave; Isotope; Spectroscopy; Metrology; Subharmonic; Femtosecond; Parametric oscillator; ,Octave-wide mid-infrared frequency comb source,['http://www.opticsinfobase.org/abstract.cfm?URI=ol-33-16-18']
1089,S08-379_hydrogels-methods-of-making,62808,"Stanford researchers have developed a novel, highly localized and low-toxicity therapeutic approach to reducing or preventing cancer cell dissemination, metastasis and recurrence.  This invention describes ...",Gel; Cancer; Metastasis; Cell adhesion; Chemotaxis; Analgesic; Antibacterial; Perioperative mortality; Chemotherapy; Radiation therapy; Biocompatibility; Drug delivery; Protein; Polymer; Immunogenicity; Microparticles; Cytotoxicity; ,"Hydrogels, Methods of Making Hydrogels, Methods of Using Hydrogels, and Methods of Isolating, Trapping, Attracting, and/or Killing Cancer Cells",['http://pubs.acs.org/doi/pdfplus/10.1021/bm80134']
1090,S08-375_a-filter-circuit-with-a-jammer,62807,"This patented filtering circuit architecture is designed to suppress an FSK (frequency-shift-keying) modulated jammer for energy efficient narrow band wireless communications. Traditionally, analog intermediate frequency ...",Frequency-shift keying; Dynamic range; Signal-to-noise ratio; Integrated circuit; Watt; Mixed-signal integrated circuit; ,A Filter Circuit with a Jammer Generator,['http://dx.doi.org/10.1109/TCSII.2010.20928']
1091,S08-370_a-noninvasive-in-vivo-assay-of,62806,Stanford researchers have further developed a new technique for magnetic resonance imaging (MRI).   The technique called hyperpolarized carbon-13 MRI dramatically increases the sensitivity for molecular ...,Assay; Magnetic resonance imaging; Nuclear medicine; Molecular imaging; X-ray computed tomography; Drug development; Infection; ,A noninvasive in vivo assay of inflammation and infection using hyperpolarized 13C magnetic resonance imaging.,[]
1092,S08-365_encapsidation-of-heterologous,62805,"Stanford investigators have developed a method to package exogenous entities, inside virus-like particles (VLPs) during cell-free protein synthesis. A variety of cargo, such as sRNAi, ...",Virus-like particle; Drug delivery; Medical imaging; Vaccine efficacy; Capsid; Immune stimulating; Vaccine; Nucleic acid; Transcription (genetics); Endogeny; Fluorophore; Firefly; Luciferase; Small hairpin RNA; ,Encapsidation of Heterologous Entities into Virus-like Particles,"['http://appft.uspto.gov/netacgi/nph-Parser?Sect1=PTO1&Sect2=HITOFF&d=PG01&p=1&u=%2Fnetahtml%2FPTO%2Fsrchnum.html&r=1&f=G&l=50&s1=%2220100167981%22.PGNR.&OS=DN/20100167981&RS=DN/2010016798', 'http://onlinelibrary.wiley.com/doi/10.1002/bit.21716/abstra']"
1093,S08-357_mapping-underground-geological,62804,A new method for underground mapping and imaging allows the use of the underground reflections of electromagnetic pulses caused by lightning (occurring up to thousands ...,Very low frequency; Electromagnetic pulse; Lightning; Radio atmospheric; Ionosphere; Earthquake; David Strauss; ,Mapping Underground Geological Structures Using Lightning-Induced Electromagnetic Pulses in the VLF Frequency Range,"['https://www.google.com/patents/US86336', 'http://purl.stanford.edu/sq681fs58']"
1094,S08-356_stanford-part-of-speech-tagger,62803,"FOR ALL LICENSING INQUIRIES PLEASE EMAIL  NLP Licensing .  This is a robust, very high performance statistical part of speech tagger, with pretrained models for ...",Part of speech; ,Stanford Part-of-Speech Tagger,[]
1095,S08-347_facs-based-assay-for-detecting,62802,A team of Stanford researchers has developed an in vitro system for the detection and quantification of basophils.  The technology can be used to identify ...,Assay; Basophil granulocyte; Eosinophil granulocyte; Autoimmune disease; Anaphylaxis; Myeloproliferative disease; Granulocyte; Skin allergy test; Antigen; Immune system; Degranulation; Cell signaling; ,FACS-based assay for detecting basophils and/or eosinophils in blood,['http://appft1.uspto.gov/netacgi/nph-Parser?Sect1=PTO1&Sect2=HITOFF&d=PG01&p=1&u=%2Fnetahtml%2FPTO%2Fsrchnum.html&r=1&f=G&l=50&s1=%2220100112628%22.PGNR.&OS=DN/20100112628&RS=DN/201001126']
1096,S08-345_rapid-sensitive-amino-acid-analysis,62801,"Researchers in Dr. Tina Cowans laboratory have developed a rapid, reliable, and sensitive analytical platform for detecting and quantifying free, underivatized amino acids from ...",Amino acid; Structural isomer; Metabolism; Cell culture; Isomer; Tissue culture; Reagent; Organic acid; Carbohydrate; Creatine; Purine; Pyrimidine metabolism; Chromatography; ,"Rapid, Sensitive Amino Acid Analysis with LC-MS/MS",['http://www.sciencedirect.com/science/article/pii/S15700232130063']
1097,S08-339_mri-jigsaw-joint-inhomogeneity,62800,A method for estimating values of a field map to generate a magnetic resonance display image with species separation is provided. A set of MR ...,Magnetic resonance imaging; Algorithm; Pixel; ,MRI - JIGSAW: Joint Inhomogeneity estimation via Global Segment Assembly for Water-fat separation,[]
1098,S08-334_particle-accelerating-optical-and,62799,"Stanford researchers have developed a new method of particle transport, manipulation, and control by means of optically excited electromagnetic modes in suitably configured photonic band ...",Photonic crystal; Structural analysis; Electron; Ion beam; Electron beam lithography; Transmission electron microscopy; Auger electron spectroscopy; Acceleration; Linear particle accelerator; Oxygen-free copper; ,"Particle Accelerating, Optical and Special Purpose Modes in Photonic Band Gap Fibers","['http://www.slac.stanford.edu/cgi-wrap/getdoc/slac-pub-14031.p', 'http://www.slac.stanford.edu/grp/arb/tn/arbvol5/AARD467.p']"
1099,S08-317_optical-absorption-enhancement-in,62798,Stanford researchers in Materials Science have developed a method of fabricating a-Si:H nanowires (NWs) and nanocones (NCs) using an easily scalable and IC-compatible process. These ...,Nanowire; Angle of incidence; Impedance matching; Cellular respiration; Solar cell; ,Optical Absorption Enhancement in Amorphous Silicon Nanocone Arrays,[]
1100,S08-316_x-ray-crystal-structures-of-anti,62797,"Patent Abstract:   The present invention provides crystals including amino acids 1-7 of SEQ ID NO:1 and a Fab fragment of 12A11, 12B4, 10D5 or 3D6, ...",X-ray crystallography; Antibody; Amino acid; Fragment antigen-binding; Epitope; Humanized antibody; ,X-ray crystal structures of anti-Abeta antibodies,['http://dx.doi.org/10.1074/jbc.M109.0451']
1101,S08-312_crystalline-amorphous-core-shell,62796,Researchers in Stanfords Materials Science department have developed a method that makes use of core-shell nanowires for improved power rate and cycling life for ...,Lithium battery; Stainless steel; Capacitance; Lithium-ion battery; ,Crystalline-Amorphous Core-Shell Silicon Nanowires as Battery Electrodes,['http://pubs.acs.org/doi/abs/10.1021/nl80363']
1102,S08-306_a-method-for-the-treatment-of,62795,Stanford researchers in the Department of Neurology have discovered a method for improving cognitive functions in mouse models of Down syndrome (DS) and Alzheimers ...,Down syndrome; Neurology; Norepinephrine; Locus coeruleus; Brainstem; Prodrug; Blood–brain barrier; Receptor (biochemistry); Agonist; Central nervous system; Carbidopa; Beta amyloid; Mutation; Clinical trial; Reuptake; Locus (genetics); Wernicke–Korsakoff syndrome; Atomoxetine; Attention deficit hyperactivity disorder; Fibromyalgia; Aysén Region; ,A Method for the Treatment of Learning and Cognitive Disabilities in People with Down Syndrome and Dementia in Alzheimer's Disease,['http://stm.sciencemag.org/content/1/7/7ra17.abstra']
1103,S08-282_configurations-for-integrated-mri,62794,Stanford researchers have developed an integrated MRI-Linac hybrid system that can increase the efficacy of image-guided radiotherapy (IGRT).  This system allows more aggressive treatment strategies ...,Radiation therapy; Linear particle accelerator; Proton; Magnetic resonance imaging; Electromagnetic interference; Monte Carlo method; Magnetic field; ,Configurations for integrated MRI-linear accelerators,[]
1104,S08-264_pluripotent-cell-lines-with-genetic,62792,"Stanford researchers have developed a method in which induced pluripotent stem cells (iPSCs) can be generated specifically for a disease of interest.  In particular, they ...",Induced pluripotent stem cell; Inhibitory postsynaptic potential; Mutation; Copy-number variation; ,Pluripotent Cell Lines with Genetic Variations and Methods of Use Thereof,['http://www.freepatentsonline.com/20100167286.p']
1105,S08-252_fiber-optic-sensor-array,62791,Optical apparatus and methods utilizing sensors operating in the reflection mode are provided. The apparatus includes at least one optical bus. The at least one ...,,Fiber-optic Sensor Array Architectures,[]
1106,S08-247_field-effect-transistor-cnfet,62790,Stanford researchers have developed a novel method for wafer-scale production of aligned and ultra-high density carbon nanotubes (CNTs) and nanotube grid.  The CNTs produced with ...,Electrode; Carbon nanotube; Flexible electronics; Flat panel display; Integrated circuit; ,"Field-Effect Transistor (CNFET), transparent electrodes and three-dimensional integration of CNFETs","['http://appft.uspto.gov/netacgi/nph-Parser?Sect1=PTO1&Sect2=HITOFF&d=PG01&p=1&u=/netahtml/PTO/srchnum.html&r=1&f=G&l=50&s1=20110133284.PGNR.&OS=DN/20110133284&RS=DN/201101332', 'http://ieeexplore.ieee.org/document/542429']"
1107,S08-229_collagen-materials-films-and,62787,"Stanford researchers have recently patented methods of making and using collagen materials, compositions and films.  This technology produces collagen scaffolds that can accurately replicate those ...",Collagen; Tendon; Cosmetics; Wound healing; Ligament; ,"Collagen Materials, Films and Methods",[]
1108,S08-217_tactile-feedback-device-with-skin,62784,"Stanford researchers have developed a patented, wearable, haptic feedback device that provides position and velocity information on the limbs and torso by imparting rotational skin ...",Haptic technology; Physical therapy; Proprioception; Prosthesis; Virtual reality; ,Tactile Feedback Device with Skin Stretch,"['http://www.popularmechanics.com/science/health_medicine/4303407.html?page', 'http://ieeexplore.ieee.org/xpl/freeabs_all.jsp?arnumber=5378626&tag', 'http://ieeexplore.ieee.org/search/srchabstract.jsp?arnumber=4810850&isnumber=4810789&punumber=4805587&k2dockey=4810850@ieeecnfs&query=%28%28a+wearable+skin+stretch+device+for+haptic+feedback+%29%3Cin%3Emetadata+%29&pos=0&access=']"
1109,S08-190_improved-method-for-fabricating-2-d,62783,Researchers in the Khuri-Yakub laboratory have developed patented two dimensional (2D) capacitive micromachined ultrasonic transducer (CMUT) arrays and methods for fabricating them with direct wafer ...,Ultrasonic sensor; Electrical breakdown; Voltage; Parasitic capacitance; High-intensity focused ultrasound; Nondestructive testing; Medical imaging; Ultrasound; Ultrasonic flow meter; Beam steering; Microelectromechanical systems; CMOS; ,Improved Method for Fabricating 2-D CMUT Arrays,[]
1110,S08-179_mri-ensuring-implant-safety-during,62781,A method for detecting coupled RF current magnetic resonance (MR) objects in a body and determining MR risk is provided. The body is scanned with ...,Magnetic resonance imaging; Circular polarization; ,MRI - Ensuring Implant Safety During MRI Procedures Using Reversed RF Polarization,['http://appft.uspto.gov/netacgi/nph-Parser?Sect1=PTO1&Sect2=HITOFF&d=PG01&p=1&u=%2Fnetahtml%2FPTO%2Fsrchnum.html&r=1&f=G&l=50&s1=%2220100179763%22.PGNR.&OS=DN/20100179763&RS=DN/201001797']
1111,S08-178_device-and-delivery-system-for-in,62780,"Researchers at Stanford have invented a device that can be advanced, placed, detached and implanted into one or more body lumens or cavities to perform ...",Heart rate; Heart sounds; Lumen (anatomy); ,Device and Delivery System for In Vivo Physiological Monitoring,[]
1112,S08-163_formation-method-of-semiconductor,62779,Engineers in Prof. Krishna Saraswat’s laboratory have developed a patented method for forming semiconductor thin films at low temperature (  Applications    Thin film deposition for ...,Thin film; Thin-film transistor; Microelectromechanical systems; Integrated circuit; ,"Formation method of semiconductor film, manufacturing method of semiconductor device, and semiconductor device",[]
1113,S08-154_mitochondrial-aldehyde,62778,"A common dominant negative allele, Aldh2*2, exists in the human population. The ALDH2*2 mutant retains only about 1-3% of the enzymatic activity of a corresponding ...",Aldehyde dehydrogenase; ALDH2; Gene therapy; Genetic disorder; Dominance (genetics); Allele; Mutation; Biogenic substance; Aldehyde; Hangover; Ischemia; Myocardial infarction; Stroke; Alzheimer's disease; Neurodegeneration; Cirrhosis; Drug metabolism; Polymorphism (biology); Knockout mouse; Zygosity; Genotype; ,Mitochondrial aldehyde dehydrogenase 2*2 (ALDH2*2) knock-in gene targeting mice-an experimental model for a prevalent human genetic disorder in East Asians,[]
1114,S08-152_zunavision-automatic-video,62777,Stanford researchers have developed a technique for placing advertisements or other content virtually onto physical surfaces in an existing video.  ZunaVision allows a user to ...,,ZunaVision: Automatic Video Composition and Blending for Creating Advertisement Inventory,[]
1115,S08-142_solution-sheared-deposition-of,62776,"Researchers led by Dr. Zhenan Bao in Chemical Engineering at Stanford University have developed a facile, scalable, and general solution shearing process for fabricating organic ...",Thin-film transistor; Organic field-effect transistor; Thin film; Spin coating; Consumer electronics; ,Solution Sheared Deposition of Organic Semiconductor Thin-Films with Oriented Crystalline Morphology,[]
1116,S08-140_anti-enl-monoclonal-antibody,62775,"Researchers in Dr. Michael Clearys laboratory at Stanford University have developed a highly specific monoclonal antibody for ENL, a proto-oncoprotein associated with pediatric and ...",MLL (gene); Histone methyltransferase; Cyclin; Cyclin-dependent kinase; Transcription (genetics); Histone; Lysine; Methyltransferase; Antibody; Regulation of gene expression; Covalent bond; ,Anti-ENL monoclonal antibody,[]
1117,S08-139_anti-af5-monoclonal-antibody,62774,"Researchers in Dr. Michael Clearys laboratory at Stanford University have developed a highly specific monoclonal antibody for AF5, a proto-oncoprotein associated with pediatric and ...",Monoclonal antibodies; Acute myeloid leukemia; Chromosomal translocation; MLL (gene); Leukemia; Prognosis; Protein; Fusion protein; Antibody; Pathogenesis; Regulation of gene expression; Covalent bond; P-TEFb; Carcinogenesis; ,Anti-AF5 monoclonal antibody,['http://ac.els-cdn.com/S1535610810000036/1-s2.0-S1535610810000036-main.pdf?_tid=e60d29b2-3ef4-11e2-8061-00000aacb361&acdnat=1354723412_1d9fa461be47587e07840794c03d06']
1118,S08-126_afm-cantilevers-with-integrated,62773,Stanford researchers in Electrical Engineering have developed a cantilever that incorporates a small resonator with reference fingers at the end of the cantilever to form ...,Atomic force microscopy; Cantilever; Resonance; Inertia; Crosstalk (electronics); ,AFM Cantilevers with integrated high-bandwidth force sensors,[]
1119,S08-122_mesh-based-performance-capture-from,62772,Researchers from Stanford University and the Max Planck Institute have patented a new marker-less approach to capturing human performances from multi-view video.  This algorithm jointly ...,Free viewpoint television; Algorithm; Motion capture; ,Mesh-based Performance Capture from Multi-view Video,"['http://www.newscientist.com/article/dn14007-motioncapture-system-adds-costume-to-the-drama.html#.VO5zDtt0y', 'https://people.mpi-inf.mpg.de/~nahmed/sig08.p']"
1120,S08-115_force-control-of-a-permanent-magnet,62771,Stanford researchers have developed a method for precisely controlling the force exerted by a permanent magnet for use in medical systems. This system is ideally ...,Force; Endoscopy; Catheter; Biomechatronics; Magnetic field; ,Force Control of a Permanent Magnet for Minimally-Invasive Procedures,"['https://www.google.com/patents/US83168', 'http://dx.doi.org/10.1109/BIOROB.2008.47628']"
1121,S08-108_minicircle-vector-for-non,62770,"The minicircle is a non-viral DNA vector for non-insertional transgene expression.  A typical minicircle contains a transgene expression cassette, and is free of all other ...",Vector (molecular biology); Transgene; DNA; Plasmid; Antibiotic resistance; DNA replication; CpG site; Transfection; Bacteria; Restriction enzyme; Arabinose; Genome; Good manufacturing practice; Gene therapy; Preventive medicine; Broth; Erythropoietin; ,minicircle vector for non-insertional transgene expression in quiescent cells and tissues,"['http://www.ncbi.nlm.nih.gov/pubmed/201399', 'http://www.liebertonline.com/doi/pdfplus/10.1089/hum.2005.16.1', 'http://kaylab.stanford.edu/manuscripts/MT.9.03.Chen.p', 'http://appft1.uspto.gov/netacgi/nph-Parser?Sect1=PTO2&Sect2=HITOFF&p=1&u=%2Fnetahtml%2FPTO%2Fsearch-adv.html&r=1&f=G&l=50&d=PG01&S1=20040214329.PGNR.&OS=DN/20040214329&RS=DN/200402143', 'http://appft1.uspto.gov/netacgi/nph-Parser?Sect1=PTO2&Sect2=HITOFF&p=1&u=%2Fnetahtml%2FPTO%2Fsearch-adv.html&r=1&f=G&l=50&d=PG01&S1=20060223778.PGNR.&OS=DN/20060223778&RS=DN/200602237', 'http://appft.uspto.gov/netacgi/nph-Parser?Sect1=PTO1&Sect2=HITOFF&d=PG01&p=1&u=%2Fnetahtml%2FPTO%2Fsrchnum.html&r=1&f=G&l=50&s1=%2220100075401%22.PGNR.&OS=DN/20100075401&RS=DN/201000754']"
1122,S08-106_method-and-apparatus-for-ultrasound,62769,"Stanford researchers have patented an ultrasound-assisted delivery device, which includes a focused ultrasound transducer with an ultrasound focal point, a real-time imaging device with an ...",Endoscopy; Medical ultrasonography; Drug delivery; ,Method and Apparatus for Ultrasound Assisted Local Delivery of Drugs and Biomarkers,[]
1123,S08-100_a-scalable-delay-power-control,62768,"Achieving good balance between power consumption and system overall performance is an important aspect of any wireless network. To enhance power control in wireless networks, ...",Algorithm; Signal-to-interference-plus-noise ratio; Pareto efficiency; ,A Scalable Delay-Power Control Algorithm for Bandwidth Sharing in Wireless Networks,[]
1124,S08-099_anti-af4-monoclonal-antibody,62767,"Researchers in Dr. Michael Clearys laboratory at Stanford University have developed a highly specific monoclonal antibody for AF4, a proto-oncoprotein associated with pediatric and ...",Protein; MLL (gene); Histone methyltransferase; Transcription (genetics); Antibody; Regulation of gene expression; Covalent bond; ,Anti-AF4 monoclonal antibody,[]
1125,S08-098_automated-archiving-of-scientific,62766,"This patented system stores, indexes, serves and archives large data sets over long periods of time. It is particularly useful for data, including that from ...",,Automated Archiving of Scientific Data,[]
1126,S08-094_mri-hyperpolarized-13c-dynamic,62765,A method for performing magnetic resonance spectroscopy is described. The method generally includes applying a tailored multiband spectral-spatial radio frequency excitation pulse to a sample ...,Magnetic resonance imaging; Radio frequency; Resonance; ,MRI - Hyperpolarized 13C Dynamic Chemical Shift Imaging with Tailored Multiband Excitation Pulses,[]
