,fileslug,id,sf_abstract,tags,title,link
0,S17-473_high-affinity-small-molecule-probes,241051,The chloride channel (CLC) family is a class of membrane proteins that regulates the flux of chloride ions across cell membranes. These ion channels play ...,,"High-affinity, small-molecule probes for the CLC-2 chloride ion channel",[]
1,S18-258_device-and-method-for-preventing-or,241050,"Stanford researchers have prototyped a simple, pulsating cast insert that delivers localized pressure to manage post-traumatic swelling about the ankle and foot, especially swelling due ...",,Device and Method for Preventing or Reducing Swelling About the Ankle,[]
2,S17-289_silicon-sealing-for-high,241044,Stanford researchers at the Yi Cui Lab have demonstrated a dual-functional silicon sealing on silicon hollow structures which greatly improves the mechanical stability of the ...,,Silicon sealing for high performance battery anode materials,['https://pubs.acs.org/doi/10.1021/acs.nanolett.8b030']
3,S18-298_compact-optical-sensor-device-to,241043,"A team of interdisciplinary researchers at Stanford have developed a small, lightweight optical strain sensor device to sensitively measure forces within the mitral valve apparatus ...",Mitral valve; ,"Compact, optical sensor device to measure forces on mitral valve structures prior to surgical repair or replacement",['https://www.ahajournals.org/doi/abs/10.1161/circ.138.suppl_1.17300?af']
4,S05-241_gait-interventions-to-lower-the,241041,"Osteoarthritis, the most common form of arthritis, is a degenerative joint disease in which mechanical factors play a very important role. Knee osteoarthritis in particular ...",,Gait interventions to lower the knee adduction moment,[]
5,S16-284_factors-to-maintain-the-stemness-of,241040,"Researchers at Stanford and their collaborators have identified Royalactin and its human homologue as novel factors that can promote ground-state, pluripotency in embryonic stem cells ...",Embryonic stem cell; ,Factors to maintain the stemness of embryonic stem cells,"['https://www.nature.com/articles/s41467-018-06256', 'http://med.stanford.edu/news/all-news/2018/12/honeybee-protein-keeps-stem-cells-youthful.ht']"
6,S14-319_iterative-minimization-procedure,241030,Stanford researchers have developed an algorithm to achieve uniform excitation and image uniformity in the presence of a non-uniform transmit field while limiting local power ...,,Iterative Minimization Procedure with Uncompressed Local SAR Estimate (IMPULSE): A Generalized and Scalable Framework for Joint Design of pTx RF Pulses,[]
7,S16-072_fat-based-registration-of-dynamic,241029,"Stanford researchers have developed an improved method to correct deformable motion in dyanamically ehanced images of the breast. The approach uses fat-only images, which are ...",,Fat-based registration of dynamic water images,[]
8,S18-145_ph-sensitive-self-assembling,241028,"Stanford researchers have developed a pH smart, amphiphilic cyclopeptide-dye probe, CH-RGD, useful for NIR-II imaging and cancer therapy. This small molecule self-assembled nanoparticle adjusts its ...",,"pH-sensitive, self-assembling cyclopeptide-dyes (CH-RGD) nanoparticles for NIR-II imaging and cancer therapy",[]
9,S15-442_adaptive-evaluation-of-level-set,240990,"Stanford researchers have developed a novel approach, Adaptive evaluation of Level Set Parameters (ALSP) for level set segmentation. This invention is a segmentation improvement for ...",,Adaptive evaluation of Level Set Parameters for Level Set Segmentation,"['https://arxiv.org/abs/1606.037', 'http://ieeexplore.ieee.org/document/774239']"
10,S17-074_efficient-flexible-scarless-genome,240984,"Researchers in Prof. Matthew Porteus’ laboratory have developed a fast, efficient scarless gene editing method that can insert, delete or mutate up to several thousand ...",,"Efficient, flexible scarless genome editing in pluripotent cells",['https://www.nature.com/articles/s41592-018-0212']
11,S17-116_li-ion-battery-cell-level,240983,"Stanford researchers have developed a simple, efficient and holistic method to solve the problem of volumetric expansion at the cell level in lithium ion batteries. ...",,Li-ion Battery Cell-Level Interlocking and Expansion Control,['http://appft.uspto.gov/netacgi/nph-Parser?Sect1=PTO2&Sect2=HITOFF&p=1&u=%2Fnetahtml%2FPTO%2Fsearch-bool.html&r=1&f=G&l=50&co1=AND&d=PG01&s1=%22Multifunctional+Energy+Storage%22&OS=%22Multifunctional+Energy+Storage%22&RS=%22Multifunctional+Energy+Storage%']
12,S14-447_drug-imprinted-hydrogel-for,240973,"A team of Stanford researchers has developed a precisely controlled hydrogel drug delivery system that prevents scarring and promotes wound healing in large, full thickness ...",Wound healing; ,Drug-imprinted hydrogel for controlled-release wound healing therapy with FAK inhibitors,['https://doi.org/10.1016/j.jid.2018.04.0']
13,S18-419_a-biomimetic-electronic-skin-e-skin,240972,Researchers in Professor Zhenan Bao’s group at Stanford University have developed a biomimetic soft electronic skin (e-skin) with multiple levels of biologically inspired patterning that ...,,A biomimetic electronic skin (e-skin) with discriminating forces,"['http://robotics.sciencemag.org/content/3/24/eaau69', 'https://news.stanford.edu/2018/11/21/stanford-develops-electronic-glove-gives-robots-sense-touc']"
14,S17-501_smash-cars-a-drug-off-chemogenetic,240967,"Background  Researchers in Prof. Crystal Mackall’s laboratory at Stanford University are focused on translational research related to cancer immunotherapy, including basic T-cell function and tumor ...",,"SMASh_CARs: A ""drug off"" chemogenetic system for regulating CAR T-cell therapy",[]
15,S17-038_a-method-for-personalized-brain,240963,Stanford researchers have developed a new diagnostic and treatment development framework that focuses on understanding causality in the brain circuits of individual patients as a ...,Neurostimulation; ,A method for personalized brain network neurostimulation treatment,[]
16,S17-394_artist,240960,Researchers in Prof. Amit Etkin’s lab have created the first automated method for artifact rejection in simultaneously acquired transcranial magnetic stimulation (TMS) and electroencephalography (EEG) ...,,Artist,[]
17,S18-053_identification-of-predictors-of,240959,"Researchers in Prof. Amit Etkin’s laboratory have developed machine learning based methodology to predict differential response to the antidepressant sertraline versus placebo, drawing on data ...",,Identification of predictors of antidepressant treatment using an emotional conflict task,[]
18,S18-116_multi-bit-per-cell-resistance,240958,Researchers in the Robust Systems Group at Stanford University developed a method for dividing the available resistance window in a multi-bit per cell Resistive RAM ...,,"Multi-bit per cell Resistance Distribution Control for Fast, Efficient Read and Program for Resistive RAM",['https://ieeexplore.ieee.org/document/85440']
19,S18-124_programming-algorithm-for-fast,240957,Stanford researchers in the Robust Systems Group at Stanford University developed a programming algorithm for 3-bit per cell Resistive RAM at the array level that ...,,"Programming Algorithm for Fast, Accurate and Energy-Efficient ReRAM",[]
20,S18-403_use-of-machine-learning-on,240956,"Researchers in Prof. Amit Etkin’s laboratory have developed machine learning based methodology to predict differential response to the antidepressant sertraline versus placebo, drawing on data ...",Machine learning; Electroencephalography; ,Use of machine learning on electroencephalography data to predict outcome with antidepressant treatment versus placebo in depression,[]
21,S18-408_method-to-treat-inflammatory-bowel,240955,"Researchers at Stanford have developed a method using a monoclonal antibody to treat inflammatory bowel disease (IBD), including Crohn’s disease and colitis.  IBD is an ...",Inflammatory bowel disease; ,Method to Treat Inflammatory Bowel Disease,[]
22,S14-468_an-algorithm-for-maximum-sar,240949,"Magnetic resonance (MR) thermometry is a fast and noninvasive method for performing the necessary temperature mapping. Typically, the heating apparatus (RF or microwave applicator) and ...",,An Algorithm for Maximum-SAR Targeted Hyperthermia,['https://patents.google.com/patent/US20160334477A1/en?oq=14%2f7114']
23,S18-391_engineered-t-regulatory-cells-to,240935,Researchers in Prof. Everett Meyer’s laboratory have developed a system to protect T regulatory (Treg) cells from immunosuppressive agents when they are used in adoptive ...,,Engineered T regulatory cells to promote expansion and improve function in cellular immunotherapy,[]
24,S16-108_an-18f-pet-nirf-smart-probe-for,240929,"Researchers at Stanford have developed a dual modality, 18F positron emission tomography (PET)/near-infrared fluorescence (NIRF) imaging probe to identify, grade and visualize astrocytic gliomas.  Treatment ...",,"An 18F PET/NIRF Smart Probe for Identifying, Grading, and Visualizing Astrocytic Gliomas",[]
25,S06-511B_peptides-to-prevent,240921,This technology is a set of short oligopeptides and formulations to inhibit tyrosinase and treat or ameliorate skin pigmentation disorders involving excess production of melanin. ...,,Peptides to prevent hyperpigmentation,['https://doi.org/10.1038/jid.2009.1']
26,S15-122_layered-electroactive-polymers-for,240920,Engineers in Prof. Mark Cutkosky’s laboratory have developed patented electrostrictive elements that can support high loads over a long lifetime when used as variable suspension ...,Electroactive polymers; ,"Layered electroactive polymers for robust and reliable variable-stiffness suspensions in robotics, prosthetics and autonomous vehicles",['http://dx.doi.org/10.1109/TMECH.2016.25864']
27,S18-204_rai1-tag-an-epitope-tagged-rai1,240910,The Rai1-Tag knock-in allele expresses a FLAG/myc-tagged RAI1 (Rai1-Tag) before Cre recombinase exposure. Cre-mediated deletion of the floxed FLAG-myc-STOP sequence results in expression of RAI1/EGFP ...,,"Rai1-Tag, an epitope tagged Rai1 allele",[]
28,S02-215A_cluster-processing-and-ranking,240908,"This invention provides a method and/or system for analyzing data using population clustering through density based merging, and a method for guiding clustering strategy through ...",,Cluster Processing and Ranking Methods Including Methods Applicable to Clusters Developed Through Density Based Merging,[]
29,S18-146_unsupervised-identification,240907,"When examining one or higher dimensional data, researchers frequently aim to identify individual subsets (clusters) of objects within the dataset. With high-dimensional data (3 ...",Projection pursuit; ,"Unsupervised identification, matching, display and quantitation of subsets (clusters) by exhaustive projection pursuit methods",[]
30,S17-412_neuro-navigation-device-for,240903,Stanford researchers have developed a marker-less neuro-navigation device that only needs to be setup once during the first transcranial magnetic stimulation (TMS) session and by ...,,Neuro-navigation device for localization of internal anatomical regions,[]
31,S18-279_health-monitoring-using-big-data,240902,Researchers at Stanford have developed a test that can be used to predict diabetes risk and insulin resistance.  Dr. Michael Snyder and colleagues conducted a ...,Big data; ,Health Monitoring Using Big Data - Diabetes,[]
32,S18-036_synthetic-calpains-for-improved,240896,Researchers at Stanford University and the University of Iowa have created synthetic calpain molecules with increased proteolytic activity that can be used for meat tenderization. ...,,Synthetic calpains for improved meat tenderization,['http://molecularcasestudies.cshlp.org/content/early/2018/02/22/mcs.a0025']
33,S17-035_molecular-probes-for-multiplexed,240890,Researchers in Prof. Garry Nolan’s laboratory have developed a new class of isotopic tags that can be used to perform high resolution multiplexed ion beam ...,Molecular Probes; ,"Molecular probes for multiplexed, super-resolution imaging and single-cell level analysis of large cell populations",[]
34,S16-117_neurological-biomarker-enables,240887,Researchers in Professor Amit Etkin’s laboratory have developed a quantitative method to predict how clinically depressed patients will respond to repetitive transcranial magnetic stimulation (rTMS) ...,,Neurological Biomarker Enables Personalized rTMS Depression Therapy,[]
35,S16-253_inducible-production-of-il-4-for,240886,Researchers at Stanford have developed methods and compositions to provide inducible production of anti-inflammatory cytokines in mesenchymal stem cells (MSCs).  MSCs have great potential in ...,,Inducible production of IL-4 for precise control of immunomodulation <i>in situ</i>,"['https://www.celltherapyjournal.org/article/S1465-3249(18)30551-6/p', 'https://onlinelibrary.wiley.com/doi/epdf/10.1002/jbm.a.365', 'https://patents.google.com/patent/WO2018071295A1/en?oq=WO+2018%2f0712']"
36,S18-107_isotope-encoded-nanotags-for-high,240884,Stanford researchers have developed metal and fluorophore doped nanoparticles that act as signal enhancers for multiplexing high-order imaging and detection. The nanoparticles can be inorganics ...,,"Isotope Encoded Nanotags for High Sensitivity, Multiplexed Imaging and Detection",[]
37,S18-160_method-to-treat-radiation-therapy,240883,Researchers at Stanford have developed methods of using a locally administered growth factor to prevent or treat oral mucositis induced by radiotherapy or chemotherapy.  Oral ...,Mucositis; ,Method to treat radiation therapy or chemotherapy-induced oral mucositis,[]
38,S15-050_mobilizing-anti-tumor-immunity-by,240881,"Researchers at Stanford have developed a new, patented strategy to enhance anti-tumor immune responses to treat cancer.  Cancer is the second leading cause of death ...",Chemerin; ,Mobilizing anti-tumor immunity by targeting chemerin receptor CCRL2,[]
39,S18-335_sim-seq-synthetic-introduced,240880,"Typical biological sequences (such a genome sequences) can have repetitive and low information regions that make assembly much more difficult, and for short fragments, often ...",,SIM-Seq -- Synthetic Introduced Mutations - Sequencing: A novel method for sequencing with a focus on resolving low information regions of sequences,[]
40,S17-243_strategy-for-more-effective,240879,Researchers at Stanford have developed a strategy to improve the efficacy of antibiotics by conjugating the antibiotic to a guanidinium-rich molecular transporter (GR-MoTr).  The overuse ...,,Strategy for more effective antibiotics- conjugation to a molecular transporter,"['https://pubs.acs.org/doi/10.1021/jacs.8b087', 'https://news.stanford.edu/2018/11/05/new-drug-strategy-antibiotic-resistant-infection', 'https://engineering.stanford.edu/magazine/article/deadly-bacteria-are-no-match-new-antibiotic-treatment-pl']"
41,S17-374_method-to-visualize-and-quantify,240878,"Dr. Manish Saggar at Stanford University has developed a new method to visualize and quantify transitions in brain activity, which may be used as a ...",Topological data analysis; ,Method to visualize and quantify transitions in brain activity using topological data analysis,['http://dx.doi.org/10.1038/s41467-018-03664']
42,S17-107_methods-for-high-performance-clamp,240855,"Engineers in Prof. Khuri-Yakub’s laboratory have developed ultrasonic methods for non-invasive flow meters to accurately measure flow rate, pressure, velocity profile and other parameters of ...",Ultrasonic flow meter; ,Methods for High Performance Clamp-on Ultrasonic Flow Meter - Circumferential Resonance,[]
43,S17-108_methods-for-high-performance-clamp,240854,"Engineers in Prof. Khuri-Yakub’s laboratory have developed ultrasonic methods for non-invasive flow meters to accurately measure flow rate, pressure, velocity and other parameters of gas ...",Ultrasonic flow meter; Lamb waves; ,Methods for High Performance Clamp-on Ultrasonic Flow Meter – Leaky Lamb Waves,[]
44,S17-422_deep-learning-method-for,240853,Nonstationary image artifacts frequently arise in MRI from off-resonance and motion. Current methods to correct these nonstationary effects are computationally expensive. Stanford researchers have developed ...,,Deep Learning Method for Nonstationary Image Artifact Correction,['https://www.ismrm.org/18/program_files/PP16.h']
45,S18-040_synthesis-of-metal-nanoparticles,240851,"Scientists at the Zare Lab have reported for the first time, a method to produce gold nanoparticles (AuNPs) and gold nanowires using water microdroplets  without ...",,Synthesis of Metal Nanoparticles and Metal Nanowires,['https://www.nature.com/articles/s41467-018-04023']
46,S13-355_method-of-treating-autoimmune,240845,Stanford researchers find that 4-methylumbelliferone (4-MU) is effective in reversing autoimmune inflammation in a mouse model of type 1 diabetes (T1D). 4-MU is currently used ...,,Method of Treating Autoimmune Diseases Using 4-Methylumbelliferone,"['https://doi.org/10.1172/JCI792', 'https://doi.org/10.1073/pnas.15250861', 'https://bpspubs.onlinelibrary.wiley.com/doi/full/10.1111/bph.139', 'https://doi.org/10.1016/j.matbio.2018.03.0']"
47,S16-051_gel-to-enhance-stem-cell-survival,240844,Researchers at Stanford have developed an injectable gel that provides slow release of pro-survival growth factors to improve transplanted stem cell survival.  Stem cell therapies ...,,Gel to enhance stem cell survival and function,['http://dx.doi.org/10.1038/s41551-018-0191']
48,S16-144_neuroprotective-treatment-for,240841,"Disease indication  - Neurodegenerative diseases [including Alzheimer’s disease, Parkinson’s disease, Amyotrophic Lateral Sclerosis (ALS), multiple sclerosis (MS), Huntington’s Disease] and neuronal injury (including spinal cord ...",Neurodegeneration; Astrocyte; ,"Neuroprotective treatment for neurodegenerative disease, neuroinflammation and neuronal injury by targeting reactive astrocytes","['https://doi.org/10.1038/nature210', 'https://med.stanford.edu/news/all-news/2017/01/toxic-brain-cells-may-drive-many-neurodegenerative-disorders.ht', 'https://doi.org/10.1016/j.immuni.2017.06.0', 'https://doi.org/10.1038/s41591-018-0051']"
49,S17-432_clearer-deeper-bioimaging-via-near,240840,"Stanford researchers in the Dai Lab have developed a near-infrared, two-photon fluorescence imaging method with higher clarity and penetration than ever before.  The method uses ...",,"Clearer, Deeper Bioimaging via Near-Infrared, Two-Photon Fluorescence Imaging",[]
50,S18-387_active-transfer-learning-deep,240839,Researchers in Prof. Vijay Pande’s laboratory have developed predictive algorithms and software to train deep neural network-based models using a technique called Active Transfer Learning ...,Computer vision; Machine learning; ,"Active Transfer Learning: deep neural network models for drug discovery, image recognition and other machine learning tasks",[]
51,S14-295_a-method-for-rapid-multi-contrast,240836,Stanford researchers have developed an improved imaging protocol for better visualization of the thalamus. This faster acquisition leads to a better delineation of structures due ...,,A method for rapid multi-contrast brain imaging,[]
52,S13-083_strain-actuated-origami-stretch,240831,"Strain-actuated origami is making stretchable electronics for positioning, gripping, assembly and controlled pressure applications more robust. The invention is a planar microelectrode array that produces ...",,"Strain-actuated origami: stretch induces tunable and reversible fold-out and pop-out features for controlled pressure application, gripper positioning, and assembly from planar-fabricated macro and microstructures.",['http://iopscience.iop.org/article/10.1088/0960-1317/23/10/105004/da']
53,S17-404_gestational-dating-by-metabolic,240830,"Stanford researchers have completed the first-ever longitudinal characterization of the meticulously-timed changes in a woman’s metabolic system, which occur during pregnancy. Maternal metabolism changes throughout ...",,Gestational dating by metabolic profile during pregnancy,[]
54,S17-086_screening-platform-to-identify,240828,Dr. Lawrence Steinman and Dr. Jonathan Rothbard at Stanford University have developed a drug screening platform to identify candidate agents that modulate the immune regulatory ...,,Screening platform to identify agents that may be used to treat inflammatory disease,"['http://dx.doi.org/10.1073/pnas.18045991', 'https://scopeblog.stanford.edu/2018/06/19/why-nicotine-mimicking-molecules-might-make-great-anti-inflammatory-drugs-for-ms-ra-gout-and-mor', 'http://med.stanford.edu/news/all-news/2018/07/nicotine-mimics-may-have-therapeutic-effect-on-inflammatory-disease.ht']"
55,S17-479_light-cleavable-cloaking-agents-to,240824,"Researchers in Prof. Eric Kool’s laboratory have developed a simple, inexpensive, one-step postsynthetic technique to switch long RNA molecules off and on in order to ...",,Light-cleavable cloaking agents to control RNA activity in vitro and in vivo,['http://dx.doi.org/10.1021/jacs.7b124']
56,S17-372_small-molecule-inhibitors-to,240806,"Disease indication  - Chemo- and radiation therapy resistant cancer, such as ovarian cancer, head and neck cancer (HNC), lung cancer, glioblastoma multiforme and breast cancer. ...",Radiation therapy; ,Small molecule inhibitors to overcome chemo- and radiation therapy resistant cancer,[]
57,S17-182_method-to-direct-t-cell-fate,240786,Researchers at Stanford have developed a method to direct T cell fate toward the T stem cell memory (TSCM) phenotype during ex vivo expansion for ...,T cell; ,Method to direct T-cell fate towards T stem cell memory phenotype,[]
58,S18-067_photonic-thermal-management-of,240785,"Stanford researchers at the Fan Lab have proposed a comprehensive approach for controlling the heating and cooling of outdoor coatings, such as paint on automobiles ...",,Photonic Thermal Management of Outdoor Colored Objects such as automobile and building exteriors,['https://www.nature.com/articles/s41467-018-06535']
59,S18-336_ultrasound-for-detecting-and,240782,"Engineers at the Khuri-Yakub Group have designed a non-surgical alternative for treating epilepsy using ultrasonic technology which can detect, localize, and suppress epileptic seizures in ...",,Ultrasound for Detecting and Suppressing Epileptic Seizure,[]
60,S18-365_crispr-go-a-method-for-programmable,240781,"Researchers at Stanford have expanded the CRISPR method to enable programmable, targeted control of spatial genomic DNA organization in the nucleus and allow for regulated ...",,CRISPR-GO: a method for programmable genome re-organization,['https://doi.org/10.1016/j.cell.2018.09.0']
61,S05-134_brain-derived-neurotrophic-factor,240763,Stanford researchers have found that Brain-derived neurotrophic factor (BDNF) promotes the in vitro development of oocytes and zygotes into preimplantation embryos. The Stanford researchers performed ...,Brain-derived neurotrophic factor; Oocyte; ,Brain-derived neurotrophic factor (BDNF) promotes oocyte maturation,['http://www.ncbi.nlm.nih.gov/pubmed/159679']
62,S10-080_proteins-and-peptides-for-maturing,240762,Researchers in Prof. Aaron Hsueh’s laboratory have identified two different secreted proteins that can be used to stimulate ovarian follicle development in vivo or in ...,Ovarian follicle; ,Proteins and peptides for maturing ovarian follicles,"['http://patentscope.wipo.int/search/en/detail.jsf;jsessionid=AEAEE60E8637711D069235F28455E6DA.wapp1?docId=WO2013090787&recNum=10&office=&queryString=&prevFilter=%26fq%3DOF%3AWO%26fq%3DICF_M%3A%22C12N%22&sortOption=Pub+Date+Desc&maxRec=299', 'http://mend.endojournals.org/content/26/7/1158.abstra']"
63,S17-153_mitochondrial-pathway-and-ribosome,240761,Researchers in Prof. Bingwei Lu’s laboratory have identified a novel pathway for treating Parkinson’s disease along with a robust biomarker for molecular diagnosis and monitoring. ...,Ribosome; ,Mitochondrial pathway and ribosome quality control genes for treatment and diagnosis of Parkinson’s disease,['https://doi.org/10.1016/j.cmet.2018.05.0']
64,S17-211_stretchable-and-elastic-polymer,240760,Engineers at the Zhenan Bao Lab have developed an elastic Li-ion conductor with dual covalent and dynamic hydrogen bonding crosslinks providing high mechanical resilience without ...,,Stretchable and Elastic Polymer Electrolyte for Lithium Ion Batteries,['https://doi.org/10.1002/adma.20180414']
65,S17-440_upconverting-nanoparticles-as-in,240759,This nanoparticle platform for electric field detection is the first inorganic platform to use both intensity and spectro-ratiometric (relative color change) readout for the determination ...,,Upconverting Nanoparticles as In Vivo and In Situ Optical Electric Field Sensors,[]
66,S18-025_an-algorithm-for-blind-mimo,240758,"Stanford researchers have proposed a novel, efficient algorithm to decode multiple-input multiple-output (MIMO) wireless signals with no channel state information (CSI) or underlying data. Current ...",,An algorithm for blind MIMO decoding,"['http://web.stanford.edu/~trdean/papers/Fast_Blind_MIMO_Decoding_Asilomar.p', 'http://dx.doi.org/10.1109/GLOCOM.2017.82541']"
67,S18-114_simple-synthesis-of-uniform-carbon,240757,"Engineers in Professor Zhenan Bao’s laboratory have developed a simple, low-cost, tunable, one-step polymerization process followed by pyrolysis for producing uniform carbon particles with a ...",,Simple synthesis of uniform carbon flower superstructures for electrocatalysts and other energy and environment applications,['https://pubs.acs.org/doi/10.1021/jacs.8b058']
68,S18-329_inhibiting-barite-scale,240748,Barite scale formation in hydraulic fracturing systems is a significant problem with regards to production and permanent formation damage.  Barite added to drilling mud (20-60 ...,,Inhibiting Barite Scale Precipitation in Hydraulic Fracturing,[]
